农用柴油机冒黑烟	柴油机冒黑烟
恩怎么幽默回复	恩怎么回复
前任访问空间删除记录	访问空间删除记录
形容男孩子性格安静的词语	形容男孩子性格的词语
李白的句子	李白的经典句子
抚顺冬天气温	抚顺冬天平均气温
子宫不好能怀孕吗	子宫能怀孕吗
家里突然有虫子	家里突然有好多虫子
吃多的副作用	吃的副作用
电动尾门多少钱	感应式电动尾门多少钱
鬼针草能治高血压吗	鬼针草能治好高血压吗
吃玉米可以减肥吗	吃黑玉米可以减肥吗
什么什么什么怪的成语四个字	什么什么什么的成语四个字
小孩生日祝福语简短精辟	小孩生日祝福语简短
武侯区公立初中有哪些	武侯区初中有哪些
脚泡白了怎么办	脚泡了怎么办
什么时候发行特殊国债	什么时候发行国债
吃荔枝上火怎么办	吃多荔枝上火怎么办
外来名词怎么判断	名词怎么判断
感冒能吹空调吗	感冒能吹冷空调吗
玻尿酸那个最好	玻尿酸那个
脚冰凉是什么原因	脚冰是什么原因
戒烟的反应	戒烟的不良反应
美国的面积	美国的总面积
男人不容易的语录	男人的语录
面对面建群怎么拉人进来	面对面建群怎么拉人进来急急急
最红的主播是谁	最红的男主播是谁
一根糯玉米的热量	一根大糯玉米的热量
凶恶近义词是什么词	近义词是什么词
白带成褐色是怎么回事	白带成黑褐色是怎么回事
南阳离洛阳多远	南阳离洛阳
大腿硬怎么减肥	大腿怎么减肥
宝宝就清鼻涕	宝宝就鼻涕
定积分的实际应用	定积分的应用
什么小狗可爱听话	什么小狗可爱
国产猫粮有哪些品牌	猫粮有哪些品牌
迷你世界造好看的房子	世界造好看的房子
风属性最强的神兽	风属性的神兽
什么叫公共卫浴	什么叫卫浴
皮肤清洁的说说	皮肤的说说
肮脏不堪怎么读	肮脏怎么读
描写伤心的外貌	描写的外貌
形容春天美丽的景色的句子	形容春天的景色的句子
幽默正能量句子	幽默搞笑正能量句子
脸上长了黑痣怎么办	脸上长了好多黑痣怎么办
你能保护我吗	你能保护我对吗
恶心想吐吐不出来	想吐吐不出来
赛乐赛真的靠谱吗	赛乐赛真的吗
表示女子聪慧漂亮的字	表示女子聪慧的字
宽松运动裤配什么衣服	运动裤配什么衣服
26岁的明星有哪些	26岁的男明星有哪些
关于诚信廉洁的名言	关于诚信的名言
我也一样 日语	我也 日语
安慰朋友心情不好的暖心句子	安慰朋友的暖心句子
酒店单人间多少钱	五星级酒店单人间多少钱
家庭好听的群名	家庭的群名
怎么挑臭螺丝	怎么挑螺丝
无敌是多么	无敌是多么寂寞
关掉后台运作	关掉所有后台运作
不对不对不对不对不对	对不对不对
英式足球用英语怎么说	足球用英语怎么说
立体帐篷怎么画	帐篷怎么画
小孩手上长水泡是怎么回事	小孩手上长很多水泡是怎么回事
你的名字叫什么	你真正的名字叫什么
怎么多开网页	怎么开网页
我的英文很好用英语怎么说	我的英文用英语怎么说
新鲜石斛能长期吃吗	石斛能长期吃吗
真幻影剑怎么用	幻影剑怎么用
老是心慌喘不上气怎么办	老是喘不上气怎么办
昆明离阜阳市有多远	急急急昆明离阜阳市有多远
古代订婚的诗句唯美	古代订婚的诗句
高档中性笔品牌排行榜	中性笔品牌排行榜
gta5自由视角怎么用	gta5自由视角怎么用您好
表示团队和谐的句子	表示团队的句子
喉咙里长了疙瘩	喉咙里长了小疙瘩
衣衫缕缕的意思	衣衫的意思
好看的经典警匪电视剧	好看的警匪电视剧
怦然心动漫画优美句子	怦然心动漫画句子
173cm的明星	173cm的女明星
设计的基本内容	设计的内容
形容漫不经心的四字词语	形容的四字词语
乳腺增生能好彻底吗	乳腺增生能好吗
矮胖穿什么裤子好看	矮胖穿什么裤子
特殊食品包括保健品吗	食品包括保健品吗
安徽著名书法家有哪些	安徽书法家有哪些
才华横溢近义词反义词	近义词反义词
勤奋好学的名人故事有哪些	勤奋的名人故事有哪些
形容海鲜很好吃的成语	形容海鲜的成语
双喜硬经典价格	双喜硬价格
老式缝纫机配件名称图	缝纫机配件名称图
怎么使用激活码	怎么使用迷你激活码
山东济南到杭州多远	山东济南到杭州
关于孤独寂寞伤心的说说	关于孤独寂寞的说说
幸运飞艇一天有多少期	飞艇一天有多少期
一个鸡翅多重	一个大鸡翅多重
来月经的最佳年龄	来月经的年龄
最小鸟类是什么	鸟类是什么
素饺子的包法	饺子的包法
农用石灰氮的价格	石灰氮的价格
怎么样让头发蓬松定型	怎么样让头发蓬松
月经期间小腹突出	月经期间小腹
吃辣椒肚子疼怎么办	吃多辣椒肚子疼怎么办
宝宝打嗝是怎么回事	宝宝老打嗝是怎么回事
女生没有处女膜正常吗	女生没有处女膜吗
做视频用什么软件	做短视频用什么软件
绿豆汤能喝多吗	绿豆汤能喝吗
福州比较好的小区	福州的小区
蒸鱼放什么配菜好吃	蒸鱼放什么配菜
今年十一是中国成立多少年	今年十一是新中国成立多少年
迷你鹦鹉鱼能混养吗	鹦鹉鱼能混养吗
为什么有些人那么过分	为什么有些人那么
十二星座谁	十二星座谁最美
肺炎来自于哪里	新型肺炎来自于哪里
亭亭玉立一般形容什么	一般形容什么
1月15出生的人好不好	1月15出生的人
老什么途什么	什么途什么
为什么女生第一次很重要	为什么女生第一次
梦到死尸是什么意思	梦到很多死尸是什么意思
专业人员的培训费计入什么费用	专业人员的培训费计入什么费用急急急
赚钱最多的平台	赚钱的平台
健康饮食格言简短	健康饮食格言
姓吴的明星有哪些人	姓吴的男明星有哪些人
喜欢纯音乐的女人	喜欢古典纯音乐的女人
易建联的真实年龄	易建联的年龄
什么精油可以丰胸紧致	什么精油可以丰胸
女生稳私部位	女生稳部位
古代著名的教育机构	古代的教育机构
什么是嘌呤	什么是高嘌呤
形容呆萌可爱的四字词语	形容可爱的四字词语
女生夸你细心怎么回	女生夸你怎么回
中午吃饭了吗	中午真的吃饭了吗
财运旺的成语	财运的成语
紧张月经推迟还是提前	月经推迟还是提前
形容婆婆年轻的词语	形容婆婆的词语
卡西欧手表哪款比较好	卡西欧手表哪款
国产 最新地址	国产 地址
拔牙后发烧头痛	拔牙后发烧
怎么辨别苹果真假耳机	怎么辨别苹果耳机
开头是怪的成语	开头是的成语
番茄有哪些做法好吃	番茄有哪些做法
想换个原装电池	想换个电池
帐篷多少钱	简易帐篷多少钱
哺乳期可以吃桃子吗	哺乳期可以吃黄桃子吗
大型基础设施项目	基础设施项目
形容情绪高昂的诗句	形容情绪的诗句
肘子怎么弄好吃	肘子怎么弄
世界上最严厉的监狱	世界上最的监狱
如何调节自动锁屏时间	如何调节锁屏时间
健康证明怎么开	省级健康证明怎么开
蜜蜂的外形特	蜜蜂的外形
糖尿病能吃瓜子吗	糖尿病能吃红瓜子吗
写认真的四字词语	写的四字词语
医用呼吸机类型	呼吸机类型
口供的正确读音	口供的读音
月经有黑渣很脏	月经有黑渣
签了合同高兴的说说	签了合同的说说
被老鼠咬了要打针吗	被黑老鼠咬了要打针吗
形容蒸蒸日上的词语	形容的词语
不要伤心了用韩语怎么说	不要了用韩语怎么说
什么蚊香液比较好	什么蚊香液
关于美好的两字词语	关于的两字词语
歌颂美好爱情的歌	歌颂爱情的歌
非师范教师资格证有用吗	非师范教师资格证吗
她很漂亮用英语怎么说	她用英语怎么说
专业洗发水品牌	洗发水品牌
良好学习的名言	学习的名言
怎么卡会员	怎么卡会员永久
小腿角质层	小腿角质层厚
花什么时候最美	花什么时候
静平衡的条件	平衡的条件
孕妇可以吃馒头吗	孕妇可以吃甜馒头吗
如何拆卸马桶	如何拆卸旧马桶
类风湿性关节炎 脚红肿	类风湿性关节炎 脚
花生米是优质脂肪吗	花生米是脂肪吗
没有最高级的形容词	没有的形容词
好养的室内盆栽有哪些	好养的室内小盆栽有哪些
身上起红斑怎么回事	身上起小红斑怎么回事
超级发烧友什么意思	发烧友什么意思
精辟犀利的说说	犀利的说说
二手哈雷摩托车报价	哈雷摩托车报价
主动取消寄修	取消寄修
世界上有鬼吗	世界上真的有鬼吗
手握拳头无力酸软	手握拳头无力
平均密度怎么计算公式	密度怎么计算公式
好听稀少的男孩姓	好听的男孩姓
描写农家乐的优美句子	描写农家乐的句子
细长近义词反义词	近义词反义词
电池快速耗电	电池耗电
联通有移动无线wifi吗	联通有移动wifi吗
我是你忠实的粉丝英文怎么说	我是你的粉丝英文怎么说
哪里可以办理假离婚	哪里可以办理离婚
中国慈善第一人是谁?	中国第一人是谁?
鹿肝的药用功效	鹿肝的功效
人工客服在哪里	人工客服在哪里急急急
优美四字词语有哪些	四字词语有哪些
糖尿病可以吃核桃吗	糖尿病可以吃大核桃吗
怎么讽刺别人丑	怎么讽刺别人
梦见小鬼抓我	梦见好多小鬼抓我
光阴含笑岁月静好的意思	光阴含笑的意思
脚一点力气都没有软绵绵	脚一点力气都没有
遇见时光的唯美句子	遇见时光的句子
家用云台摄像头推荐	云台摄像头推荐
怎样做花螺好吃	怎样做花螺
五脏六腑共同的生理特点	五脏六腑的生理特点
兰州市私立初中排名	兰州市初中排名
脚上起水泡怎么办	脚上起大水泡怎么办
假好人的成语	好人的成语
入股多少钱	入股最低多少钱
关掉后台运行	关掉所有后台运行
形容很扫兴的词语	形容很的词语
表现凶恶的成语	表现的成语
口干口苦去医院挂什么科	口干去医院挂什么科
科学决策的条件	科学决策的基本条件
吃燕麦有什么好处	吃黑燕麦有什么好处
一般电动车功率多大	一般电动车功率
医生怎样画简单	医生怎样画
狗屋的简易做法	狗屋的做法
演员黄澄澄的父亲	演员的父亲
关于轻松的说说	关于的说说
有关成长的优美段落	有关成长的段落
痛风能吃馒头吗	痛风能吃甜馒头吗
花火出版的小说	花火出版的悲伤小说
馒头干怎么烤酥脆	馒头干怎么烤
善什么拼音怎么拼	什么拼音怎么拼
真的吗你喜欢我吗	真的吗你真的喜欢我吗
弱在第一个字的成语	在第一个字的成语
cf春意盎然活动地址	cf活动地址
2019年好看的青春电视剧	2019年的青春电视剧
什么独特四字词语	什么四字词语
没网络啊	真的没网络啊
西游记的主要部分	西游记的部分
表示整齐的词语有哪些	表示的词语有哪些
fpx哪个皮肤好看	fpx哪个皮肤
反义词雪白对什么	反义词对什么
小孩子挂什么科	小孩子头痛挂什么科
手机运行内存	手机运行内存不够
乳房有硬块正常吗	乳房有大硬块正常吗
山东男人平均身高	山东男人身高
为什么姨妈会来很久	为什么姨妈会来
如何做响应式布局	如何做布局
形容同心协力的诗词	形容的诗词
虎门有哪些大型电子厂	虎门有哪些电子厂
梦到捡到海鲜	梦到捡到很多海鲜
形容计划缜密的成语	形容计划的成语
吃地瓜会胖吗	吃多地瓜会胖吗
颈椎不舒服心慌恶心	颈椎心慌恶心
后背有肿块	后背有小肿块
新鲜不同意思的造句	不同意思的造句
疫情不一样的升旗仪式	疫情的升旗仪式
青金桔怎么腌制好吃	青金桔怎么腌制
你有喜欢过一个人吗	你真的有喜欢过一个人吗
轻微荨麻疹可以不吃药吗	荨麻疹可以不吃药吗
什么治苍蝇效果好	什么治苍蝇
户外浴池简易画法	户外浴池画法
女教师的英文	教师的英文
异常近义词反义词	近义词反义词
电脑声音很大怎么办	电脑声音怎么办
绿豆怎么做好熟	绿豆怎么做好
怎么领幸运字符	怎么领字符
感受美好的名言名句	感受的名言名句
做羞羞视频的软件	做视频的软件
如何淡化疤痕	如何淡化老疤痕
乌龟的本领有哪些	乌龟的特殊本领有哪些
什么是服务	什么是新型服务
胃里一直难受想吐怎么回事	胃里一直想吐怎么回事
早上起床后头痛恶心是怎么回事	早上起床后恶心是怎么回事
金华汽车开锁公司电话	金华汽车开锁公司电话急急急
背上起痘痘是什么原因	背上起小痘痘是什么原因
火影忍者无聊集数	火影忍者集数
小腿乏力怎么回事	小腿乏力没劲怎么回事
天生身上有红痣好不好	身上有红痣好不好
喝了咖啡肚子饿	喝了黑咖啡肚子饿
竞妖娆意思是什么	竞意思是什么
传统预算方法有哪些	预算方法有哪些
如何办理网卡	如何办理无限网卡
糖尿病可以吃燕麦吗	糖尿病可以吃黑燕麦吗
怎么跟女友打招呼	怎么跟陌生女友打招呼
王者荣耀哪个好玩	王者荣耀哪个
珠海有哪些地方好玩	珠海有哪些地方
福州单身公寓房价二手	福州单身公寓房价
面条的做法大全	日式面条的做法大全
上相近的字有哪些	上的字有哪些
形容众人惊讶的成语	形容众人的成语
后背上长痘痘是什么原因	后背上长小痘痘是什么原因
什么是无线传输速率	什么是传输速率
