博士毕业最长年限	博士毕业年限
晕车吐不出来难受	晕车吐不出来
梦见穿毛衣	梦见穿大毛衣
电脑上常用的绘画软件	电脑上的绘画软件
正宗烤羊肉串的做法	烤羊肉串的做法
竟然有序的反义词	竟然的反义词
孕妇能吃玉米吗	孕妇能吃冷玉米吗
你会快乐成长吗	你会成长吗
坚持不断的近义词是什么	坚持的近义词是什么
36和45的最大公倍数	36和45的公倍数
形容父子关系融洽的成语	形容父子关系的成语
形容下雨的唯美句子	形容下雨的句子
家用冰箱有多重	冰箱有多重
联系上下文解释鳞次栉比	联系上下文解释
交通事故赔护理费怎么算	交通事故赔护理费怎么算您好
gta5卡无限原料	gta5卡原料
家运兴旺的成语	家运的成语
好吃的传统糕点	好吃的糕点
18禁止看的黄网站	18禁止看的网站
甜一点的音乐	一点的音乐
怎样让自己快速成功	怎样让自己快速
血热有毒怎么调理	血热怎么调理
表示酸的四字词语	表示的四字词语
三只小猪主要的内容	三只小猪的内容
什么头发颜色好看	什么头发颜色
宝宝大便拉不出来怎么办	宝宝大便干拉不出来怎么办
历史最惨的美人	历史的美人
怎么测试二手显卡	怎么测试显卡
孕妇能吃玉米吗	孕妇能吃黑玉米吗
电视机怎么换遥控器	电视机怎么换新遥控器
无聊翻译成古文	翻译成古文
西安距离重庆多远	西安距离重庆
红烧肉加腐乳好吃吗	红烧肉加腐乳吗
中国还有贫困县吗	中国还有县吗
男护士怎么考	护士怎么考
以难开头的诗句	以开头的诗句
鳞状上皮内病变如何治疗	鳞状上皮内高度病变如何治疗
地中海贫血轻度怎么补	地中海贫血怎么补
手机不能充电了	手机不能快速充电了
骂肥女人的句子	骂女人的句子
小孩鸡痒红肿怎么回事	小孩鸡痒怎么回事
裸露镜头多的国产电视剧	裸露镜头多的电视剧
高中常见应用文格式	高中应用文格式
白头偕老的唯美诗句	白头偕老的诗句
祈祷家人平安的句子	祈祷家人的句子
温柔妩媚的意思	妩媚的意思
火龙果什么时候成熟上市	火龙果什么时候上市
哺乳期能吃燕麦吗	哺乳期能吃黑燕麦吗
白苍蝇是什么样子	苍蝇是什么样子
数列常用的求和方法	数列的求和方法
充电显示怎么设置	充电显示殷怎么设置
最大扭矩和马力	最大扭矩和最大马力
天津的大学有哪些	天津的好大学有哪些
吃鳕鱼的好处	吃黑鳕鱼的好处
怎样做无限起泡胶?	怎样做起泡胶?
欧式眉毛在纸上的画法	眉毛在纸上的画法
早上吃什么	早上吃什么比较好
跑步的速度是多少	跑步的平均速度是多少
支付宝注册流程图简易	支付宝注册流程图
我们共同来玩个游戏好不好	我们来玩个游戏好不好
外国的书籍	外国有名的书籍
凉皮粘稠不成形	凉皮不成形
文艺霸气的战队名字	文艺的战队名字
楚留香怎么高清截图	楚留香怎么截图
脚上长鸡眼怎么办	脚上长满鸡眼怎么办
空调立式有没有外机	空调有没有外机
打狂犬疫苗后红肿	打狂犬疫苗后
失去妈妈的痛苦歌曲	失去妈妈的歌曲
别人夸你帅气幽默回复	别人夸你幽默回复
吃中药可以治颈椎病吗	吃中药可以治好颈椎病吗
鱼缸客厅摆放	中式鱼缸客厅摆放
续航能力	续航能力不行
面筋和什么炒好吃	面筋和什么炒
形容人动作流畅的成语	形容人动作的成语
监督相近的词语	监督的词语
用色彩表示四季	用不同色彩表示四季
家用垃圾桶多高	垃圾桶多高
湿垃圾主要包括	垃圾主要包括
脸有轻微浮肿怎么回事	脸有浮肿怎么回事
玩的开心英文	玩的英文
童年的诗歌简短	童年的诗歌
鼻子痒有血块	鼻子有血块
防晒中的有害成分	防晒中的成分
怀孕能喝茶水吗	怀孕能喝淡茶水吗
乔丹和科比谁帅	乔丹和科比谁
伤感的优美句子	伤感的句子
二手宝格丽项链价格表	宝格丽项链价格表
好看简单的馒头	好看的馒头
脚老抽筋是怎么回事	脚抽筋是怎么回事
纪委最轻的处理	纪委的处理
好看又好玩的游戏	又好玩的游戏
和平精英换什么名字好听	和平精英换什么名字
友好的亲切的英文翻译	友好的的英文翻译
使我们冷静的英文	使我们的英文
非洲现在有多少个独立国家	非洲现在有多少个国家
大便带粘液怎么回事	大便带黄粘液怎么回事
频繁出虚汗的原因	出虚汗的原因
有关喜庆的诗词	有关的诗词
唱一首歌吗	唱一首歌好吗
明确知道哪一天受孕怎么算预产期	知道哪一天受孕怎么算预产期
短视频直播需要哪些设备	视频直播需要哪些设备
相册制作视频的软件	相册制作短视频的软件
干腐竹要泡多久	腐竹要泡多久
什么是新型冠状疫情	什么是冠状疫情
计算错误英文怎么说	计算英文怎么说
在哪里看皮肤比较好	在哪里看皮肤
酵母菌常见形态	酵母菌形态
九个月宝宝肥胖	九个月宝宝
发烧可以开空调吗	发烧可以开冷空调吗
法定哺乳假期多长时间	哺乳假期多长时间
大红细胞直径是多少	细胞直径是多少
为什么白带是褐色	为什么白带是黑褐色
梦见穿别人衣服	梦见穿别人旧衣服
电池寿命	电池寿命短
男的如何硬持久	男的如何持久
看韩漫比较好的软件	看韩漫的软件
什么东西最亮	什么东西最
干燥英语怎么读音发音	英语怎么读音发音
什么是检索	什么是基本检索
瓶子怎么画	立体瓶子怎么画
形容花蕊的优美词语	形容花蕊的词语
形容人轻浮的成语	形容人的成语
晋江著名小说作者	晋江小说作者
早春呈水部张十八员外属于律诗还是绝句	早春呈水部张十八员外属于律诗还是绝句麻烦
小腿凉疼是怎么回事	小腿凉是怎么回事
苹果2008年股价	苹果2008年最低股价
18÷3×3=18÷9=2对不对	18÷3×3=18÷9=2
痛风能吃大豆吗	痛风能吃黑大豆吗
湿热痤疮最好的治疗方法	痤疮最好的治疗方法
祝自己前程似锦的诗句	祝自己的诗句
睡觉起来突然眼睛模糊	睡觉起来眼睛模糊
肺部微小纤维结节	肺部纤维结节
端午节词句简短	端午节词句
二手冰柜在哪里买	冰柜在哪里买
花的什么颜色最多	花的什么颜色
何首乌怎样泡酒更好	何首乌怎样泡酒
形容销售不容易的句子	形容销售的句子
什么是成功课文	什么是课文
白羊座颜值高吗	白羊座女颜值高吗
怎么才能让女人爽	怎么才能让女人
副部级医院有哪些	医院有哪些
马路上怎么拍照好看	马路上怎么拍照
南昌比较好的招聘网站	南昌的招聘网站
中国人口多少最好	中国人口多少
五月天歌词温柔	五月天歌词
台式windowsxp怎么重装系统	windowsxp怎么重装系统
有点重的英文怎么说	有点的英文怎么说
温文雅致的意思	温文的意思
微信上的好玩小程序	微信上的小程序
比亚迪电动出租车价格	比亚迪出租车价格
有用功率计算公式	功率计算公式
身上关节疼	身上不舒服关节疼
王源帅不	王源帅不帅
二手苹果手机发热严重	苹果手机发热严重
张家口连续多少天无新增	张家口多少天无新增
小肚子痒是怎么回事女性	小肚子是怎么回事女性
板式楼梯的设计内容	楼梯的设计内容
如何画简单人物	如何画人物
米津玄师好听的歌	米津玄师的歌
紫苏子的药用功效	紫苏子的功效
电视双向网络怎么开通	电视网络怎么开通
博物馆的英文	科学博物馆的英文
新生儿两手抓的紧紧的	新生儿两手抓的紧紧的您好
世界拳击手排名	世界重量级拳击手排名
好听时尚的网名	时尚的网名
有小型粉碎机吗	有粉碎机吗
什么满什么成语	什么满什么满成语
制作简单的手工艺品	制作的手工艺品
什么十足四字词语	什么四字词语
怎样赶走苍蝇	怎样赶走大苍蝇
比较的英文缩写	比较霸气的英文缩写
勇敢造句一年级最短	勇敢造句一年级
鲜猪肝怎么泡	猪肝怎么泡
榴莲冻多久好吃	榴莲冻多久
电表有几种型号	单相电表有几种型号
身上长透明水泡图片	身上长水泡图片
对落后员工的鼓励	对员工的鼓励
场景描写优美句子	场景描写句子
野生南鳢鱼市场价	南鳢鱼市场价
男生温柔的个性签名	男生的个性签名
手脚冰冷盗汗是什么原因	手脚盗汗是什么原因
今年的电视剧	今年比较好的电视剧
化妆必不可少的化妆品	化妆的化妆品
教师资格证值钱吗	教师资格证吗
男男国产电视剧推荐	男男电视剧推荐
表示犹豫动作的四字词语	表示动作的四字词语
八个月宝宝睡觉满头大汗	八个月宝宝睡觉
我觉得你很可爱的英文	我觉得你的英文
鸡蛋可以放鸡精有毒吗	鸡蛋可以放鸡精吗
临时身份证办一下要多久	身份证办一下要多久
翔字怎么写好看	翔字怎么写
小龙虾能吃虾米吗	小龙虾能吃小虾米吗
脸上皮肤痒脱皮怎么办	脸上皮肤脱皮怎么办
深圳哪里	深圳哪里好玩
中国最早的史诗	中国的史诗
小孩子脾气犟	小孩子脾气
怎么祝福男生生日快乐	怎么祝福男生
蔡徐坤伤感句子	蔡徐坤句子
身体总是瘦怎么回事	身体总是怎么回事
正常血压是多少	血压是多少
狐狸的夏天相似的电视剧	狐狸的夏天的电视剧
大蒜叶烧什么好吃	大蒜叶烧什么
不对不对不对不对不对	给对不对
苹果手机有点迟钝	苹果手机有点
女的说难受怎么回复	女的说怎么回复
怎样去除痘印	怎样去除老痘印
进入充电模式	进入快速充电模式
沉稳睿智什么意思	沉稳什么意思
为什么日本女人温柔	为什么日本女人
手机万能测量工具软件	手机测量工具软件
玫瑰金重还是黄金重	玫瑰金还是黄金
降血压食物有哪些	降血压最好食物有哪些
眼睛痒用什么眼药水	眼睛骚痒用什么眼药水
特别霸气特别拽的句子	特别特别拽的句子
酱油怎么炒好吃	酱油怎么炒
张店最好的幼儿园	张店最好的公立幼儿园
精辟短语四个字	短语四个字
急性管状淋巴管炎	管状淋巴管炎
什么工作干净比较好	什么工作比较好
标准的胸围,腰围,臀围是多少	标准的胸围,腰围,臀围是多少急急急
晚安的特殊符号	晚安的符号
曹操著名的诗词	曹操的诗词
表达忧郁的句子	表达的句子
家里出现陌生烟头	家里出现烟头
支原体可以治愈彻底吗	支原体可以治愈吗
求三角形的面积公式	求正三角形的面积公式
时光渐行渐远的意思	时光的意思
什么是急性贫血的症状	什么是贫血的症状
带abs的摩托车	带abs的电动摩托车
二手6米8货车价格	6米8货车价格
医务人员怎么画简单	医务人员怎么画
国产真空采血管品牌	真空采血管品牌
国际奥林匹克委员会是一般性国际组织吗	国际奥林匹克委员会是国际组织吗
轻微低血糖要注意什么	低血糖要注意什么
描写烟花的优美诗句	描写烟花的诗句
铃木一彻的电影	铃木的电影
间接喉镜能查出什么	喉镜能查出什么
每天不来几发就痒	每天不来几发就
家用熏香哪个品牌好	熏香哪个品牌好
怎么用手抓蛇最安全	怎么用手抓蛇
中国有哪些超市	中国有哪些大超市
长沙去南京	长沙去南京高铁
抑郁症和双重精神障碍	抑郁症和精神障碍
gta5复仇者怎么地毯式轰炸	gta5复仇者怎么轰炸
动漫女生画法可爱	动漫女生画法
孕妇可以吃柿子吗	孕妇可以吃甜柿子吗
钻石最大出产国	钻石出产国
背上长痘痘的原因	背上长满痘痘的原因
DNF神枪手霸气名字	DNF神枪手名字
陌生交友软件是骗局吗	交友软件是骗局吗
打开开关机	打开自动开关机
一到晚上头痛胸闷气短	一到晚上胸闷气短
不吃晚饭可以减肥吗	不吃早晚饭可以减肥吗
五菱宏光s二手报价	五菱宏光s报价
中午吃什么最好	中午吃什么
初级准考证打印时间查询	准考证打印时间查询
洛阳有什么酒	洛阳有什么酒比较好
成天迷迷糊糊想睡觉是怎么回事	成天想睡觉是怎么回事
历史上厉害的公主	历史上的公主
徐州离常州多远	徐州离常州
猫可以吃昆虫吗	猫可以吃小昆虫吗
离上海最近的高速服务区	离上海最近的服务区
手机充电缓慢	普通手机充电慢
玩具怎么摆好看	玩具怎么摆
电动牙刷的正确使用方法	电动牙刷的使用方法
指甲有横纹是怎么回事	指甲有凸横纹是怎么回事
云顶之弈最欢乐阵容	云顶之弈最阵容
落难无助的诗句	落难的诗句
猪皮怎么做好吃	酸甜猪皮怎么做好吃
形容女孩恬静美好	形容女孩美好
表示慈祥的词语有哪些?	表示的词语有哪些?
四川大学国家级一流本科专业	四川大学一流本科专业
如何挑选英短蓝白	如何挑选蓝白
去除鱼尾纹的简单方法	去除鱼尾纹的方法
提供巨大帮助英文	提供帮助英文
脸上有白斑是怎么回事	脸上有小白斑是怎么回事
资信良好是什么意思	资信是什么意思
上届奥运会在哪举行	奥运会在哪举行
晚上睡觉胸痒	晚上睡觉胸
民办教师招聘网站有哪些	教师招聘网站有哪些
如何戴假发	如何戴好假发
眼睛干涩眼角发痒是怎么回事	眼睛眼角发痒是怎么回事
假阳性是怎么造成的	阳性是怎么造成的
顺义最好的小区	顺义的小区
甲状腺过高不能吃什么	甲状腺不能吃什么
表示不可思议的词语有哪些	表示的词语有哪些
轻度中度近视标准	轻度近视标准
姨妈能不能吃荔枝	姨妈能不能吃新鲜荔枝
一万多的自行车	一万多的电动自行车
甲亢可以治愈吗	轻微甲亢可以治愈吗
黄历幸运数字	老黄历幸运数字
13岁女孩胸里有硬块不痛	13岁女孩胸里有硬块
写给闺蜜伤感的话	写给闺蜜的话
ps把模糊字体变清晰	ps把字体变清晰
表现人物伤心的词语	表现人物的词语
什么糯米粉好吃	什么糯米粉
上古卷轴5拉罗夫在哪	急急急上古卷轴5拉罗夫在哪
比熊犬能吃西红柿吗	比熊犬能吃小西红柿吗
大家好同学们的英语	同学们的英语
形容雨夜的唯美诗句	形容雨夜的诗句
k5原装屏幕价格	k5屏幕价格
没有颜色的翡翠好不好	没有颜色的翡翠
形容倒霉的文言文	形容的文言文
过敏氧氟沙星凝胶能擦脸吗	氧氟沙星凝胶能擦脸吗
膝盖青紫怎么办	膝盖怎么办
梦见手里拿着干树枝	梦见手里拿着树枝
手臂突出的骨头叫什么	手臂的骨头叫什么
月经量是什么原因	月经量太多是什么原因
怎么才能怀上宝宝	怎么才能怀上男宝宝
形容自己孤独的诗	形容自己的诗
祝福你生日快乐 歌曲	祝福你 歌曲
武汉地域面积多大	武汉地域面积
什么样的折扇比较好	什么样的折扇
赞扬勤奋的诗句	赞扬的诗句
姓王女孩二字名字好听	姓王女孩二字名字
耐玩好玩的手机游戏	耐玩的手机游戏
湖南超载新规	湖南高速超载新规
后脑勺有个凸起的骨头	后脑勺有个凸起的小骨头
友邦保险是外资吗	友邦保险是纯外资吗
关于乐观积极的英语句子	关于积极的英语句子
腿上长红痘痘	腿上长痘痘
后背脊椎右侧疼	后背脊椎右侧
喝红糖水有什么好处	喝黑红糖水有什么好处
计算机中的最小单位	计算机中的单位
喝酒后脑勺痛	喝酒后脑勺
和平精英怎么健康系统	和平精英怎么系统
什么叫质量	什么叫相对质量
身体上出现硬块	身体上出现小硬块
出自左传的经典成语	出自左传的成语
手心的温柔歌词	手心的歌词
着床成功分泌物	着床分泌物
早上吃什么	早上吃什么好
梦见自己伤心哭泣	梦见自己哭泣
银耳煮什么汤好吃	银耳煮什么汤
菩提怎么烧好吃	菩提怎么烧
梦见自己的员工	梦见自己的女员工
陈粒好听的歌曲	陈粒的歌曲
超长反义词是什么呢?	反义词是什么呢?
上海偏僻的地方	上海的地方
手机很快黑屏	手机黑屏
表达干净整洁的成语	表达干净的成语
胸部疼可以按摩吗	胸部可以按摩吗
经期吃什么水果	经期吃什么好水果
有痛风能吃竹笋吗	有痛风能吃小竹笋吗
石斛怎样食用比较好	石斛怎样食用
你想要什么怎么幽默回答	你想要什么怎么回答
最牛的广告词	最的广告词
word标题多级列表	word标题列表
美好什么什么的成语	什么什么的成语
大树的特征	大树的共同特征
白面糊涂怎么做	白面怎么做
婚后喜欢上同事怎么办	婚后喜欢上女同事怎么办
关于蔷薇的唯美诗句	关于蔷薇的诗句
孕妇可以吃柿子吗	孕妇可以吃硬柿子吗
可爱女生网名二字	女生网名二字
国家最高决策机构	国家决策机构
我会加油努力的英语怎么说	我会加油的英语怎么说
和老公在一起开心的句子	和老公在一起的句子
提供有力支撑的近义词	提供支撑的近义词
绿色的面膜	绿色的清洁面膜
中国优秀的政法大学	中国的政法大学
不对不对不对不对不对	爱你对不对
科学的方法	科学有效的方法
惆怅粤语怎么读	粤语怎么读
月经有血块怎么回事	月经有大血块怎么回事
没什么好说的	真的没什么好说的
在家惬意的说说	在家的说说
人民银行大额系统关闭时间	人民银行系统关闭时间
心脏不行有什么症状	心脏有什么症状
海味鲜怎么吃	海味怎么吃
什么来什么亮成语	什么来什么成语
医用醋酸的作用	醋酸的作用
驿站大概是什么意思	麻烦驿站大概是什么意思
毕业论文署名怎么写	毕业论文署名怎么写麻烦
r9原厂外屏多少钱	r9外屏多少钱
婚礼主持词简单	婚礼主持词
标准单人被多大尺寸	标准单人被尺寸
更换原始壁纸	更换壁纸
山西的独特风俗习惯	山西的风俗习惯
脖子怎么按摩	脖子酸疼怎么按摩
祝年轻老师生日祝福语	祝老师生日祝福语
怎么卖面膜	怎么卖好面膜
送给老公早上好的句子	送给老公的句子
兰州到白银长途汽车	兰州到白银汽车
黄金好看还是铂金好看	黄金还是铂金
2020国产高分电影	2020高分电影
迷你世界最长的高铁	世界最长的高铁
孕妇能吃韭菜吗	孕妇能吃黄韭菜吗
眼屎多代表什么	眼屎代表什么
高速200多公里开车需要多久	200多公里开车需要多久
超级时间管理者	时间管理者
野生蚂蚁吃什么	蚂蚁吃什么
哪些是碱性食物	哪些是高碱性食物
司马迁的主要著作	司马迁的著作
忘不了你的句子	忘不了你的好句子
情人之间伤心的话	情人之间的话
丑桔皮可以吃吗	桔皮可以吃吗
爽快造句怎么造	造句怎么造
形容钱的短句	形容钱来之不易的短句
什么叫沉甸甸的爱	什么叫的爱
适合夫妻看的电影感人	适合夫妻看的电影
小猫畸形的原因	小猫的原因
顺丰生鲜运输价格	顺丰运输价格
形容时光静谧的古诗	形容时光的古诗
小龙虾的正确处理方法	小龙虾的处理方法
李白的诗洒脱奔放	李白的诗洒脱
表示非常明显的成语	表示非常的成语
怎样治脚气	怎样治好脚气
准备好用英语怎么说	准备用英语怎么说
函数的使用方法	平均函数的使用方法
离婚孩子可怜的说说	离婚孩子的说说
专职护林员管理制度	护林员管理制度
扑朴素的反义词	扑的反义词
汇丰银行 股东	汇丰银行 大股东
吃鸡语音设置	吃鸡便捷语音设置
国产西裤品牌排行榜	西裤品牌排行榜
和煦温暖的拼音	和煦的拼音
什么东西特别直	什么东西特别
孩子四种天生气质类型	孩子四种气质类型
学哪个专业最好	学哪个专业
解释截然不同的意思并造句	解释的意思并造句
经常吃玉米有什么好处	经常吃黑玉米有什么好处
透明手机壳一般是什么材质	手机壳一般是什么材质
陈绮贞好听的歌曲	陈绮贞的歌曲
穿越三国的小说	穿越三国的经典小说
杨万里最短的一首诗	杨万里的一首诗
老式腌鸡蛋的方法	腌鸡蛋的方法
表达不舍的诗句	表达的诗句
智齿疼能喝牛奶吗	智齿能喝牛奶吗
头皮有痘痘是怎么回事	头皮有红痘痘是怎么回事
孕妇可以吃泡面吗	孕妇可以吃辣泡面吗
我的妈妈很严厉用英语怎么说	我的妈妈用英语怎么说
可以组什么词	错可以组什么词
耳朵尖怎么办	耳朵怎么办
脸上斑点怎么去除	脸上黑斑点怎么去除
酒爽的作用和功效	酒的作用和功效
清明节法定几天	清明节几天
新生儿好久能睡枕头	新生儿能睡枕头
午安什么时候说最合适	午安什么时候说
新手开什么摩托比较好	新手开什么摩托
电脑硬件权威评测网站	电脑硬件评测网站
衣柜的正确摆放位置	衣柜的摆放位置
反反复复消化不良什么原因	消化不良什么原因
怎么样做槐花好吃	怎么样做槐花
20万以内二手suv	20万以内suv
初级会计有年龄限制吗	会计有年龄限制吗
怎么煮竹笋好吃	怎么煮竹笋
田七苗怎么凉拌好吃	田七苗怎么凉拌
普兰店市面积多大	普兰店市面积
好看大片有哪些电影	大片有哪些电影
来月经为什么胖	来月经为什么
公共舆论名词解释	舆论名词解释
眉毛很少怎么办	眉毛怎么办
台州到杭州多长时间	台州到杭州高铁多长时间
儿童如何养脾胃	儿童如何养好脾胃
按哪个穴位可以缓解头晕	按哪个穴位可以缓解头晕您好
租摩托车多少钱	租二手摩托车多少钱
华为荣耀8x能用电信卡吗	华为8x能用电信卡吗
新生儿适宜的温度	新生儿的温度
乳白色的蜂蜜好不好	乳白色的蜂蜜
廊坊离北京多远距离	廊坊离北京距离
计划的名称很多	计划的名称
男生最热门的发型	男生的发型
wxd医用口罩是什么意思	wxd口罩是什么意思
婴儿可以吃羊奶吗	婴儿可以吃新鲜羊奶吗
脸上皮肤下面有硬疙瘩不痛	脸上皮肤下面有硬疙瘩
的拼音怎么写	轻捷的拼音怎么写
脚起水泡怎么办	脚起痒水泡怎么办
玫瑰香有籽好没籽好	玫瑰香有籽好没籽好麻烦
二手一吨塑料桶价格	一吨塑料桶价格
炖排骨汤的做法	炖排骨汤的正确做法
感冒后喉咙沙哑	感冒后喉咙
坐在椅子上怎么睡觉	坐在椅子上怎么睡觉舒服
两个字的游戏名字伤感女生	两个字的游戏名字女生
森林专职消防员是什么	森林消防员是什么
高端运动鞋品牌大全	高端女运动鞋品牌大全
独立实验室英文	实验室英文
熟鳗鱼怎么吃	鳗鱼怎么吃
可转债的股票好不好	可转债的股票
特殊韵母什么意思	韵母什么意思
如何用彩纸做立体花	如何用彩纸做花
六的最大因数是多少	六的因数是多少
3个字好听游戏名	3个字游戏名
什么水果最闲	什么水果最
热水器 尺寸	热水器 小尺寸
为什么台湾人说话好听	为什么台湾人说话
描写城墙的优美句子	描写城墙的句子
什么是恐龙	什么是小恐龙
双向拉链的好处	拉链的好处
国际关系的基本内容是	国际关系的内容是
真正的英语怎么说	真正真正的英语怎么说
鼠宝宝聪明还是牛宝宝	鼠宝宝还是牛宝宝
怎样做鱼头炖豆腐好吃	怎样做鱼头炖豆腐
练字的唯美段落	练字的段落
屋顶自然通风器原理	屋顶通风器原理
梦见牛很听话什么意思	梦见牛什么意思
骨折后走路疼	骨折后走路
鼻子里疼有血	鼻子里有血
老鼠的画法	简易老鼠的画法
姓吴的明星有哪些人	姓吴的女明星有哪些人
传统价值观英文	价值观英文
常见地基处理方法	地基处理方法
嗓子不舒服	嗓子好难受
带有辽阔的四字成语	带有的四字成语
国外动画片排名	国外知名动画片排名
凤城到凤凰山多远	凤城到凤凰山
怀念战友的经典诗词	怀念战友的诗词
脚上有水泡怎么办	脚上有大水泡怎么办
描写公园安静的词语	描写公园的词语
梨花的具体描写	梨花的描写
一年中的特殊节日	一年中的节日
关于儿童可爱的诗句	关于儿童的诗句
胃炎可以吃馒头吗	胃炎可以吃甜馒头吗
描写小朋友可爱的四字词语	描写小朋友的四字词语
小型国企值得去吗	国企值得去吗
孕妇可以吃瓜子吗	孕妇可以吃蓝瓜子吗
肝上有一个囊肿严重吗	肝上有一个小囊肿严重吗
男生哪里最痒	男生哪里最
早上起来嗓子甜	早上起来嗓子
比较孤单的名字	比较的名字
唐山到成都多远距离	唐山到成都距离
为什么屁股黑黑	为什么屁股黑
野生国斗吃什么	国斗吃什么
哪些美食节目好看	哪些美食节目
正常男生多少cm	男生多少cm
形容人精气神的成语	形容人的成语
