华罗庚是什么样的人？,华莘庚是什么样的人？,华罗庚,华莘庚,0.040841002
尼泊尔是那个国家,圭亚那是那个国家,尼泊尔,圭亚那,0.49226144
第一财经日报电话,红河日报电话,第一财经日报,红河日报,1.0
北京电信咨询电话,上海电信咨询电话,北京电信,上海电信,1.0
朝晖路属于哪个区,中国属于哪个区,朝晖路,中国,0.2909893
历史上姓翟的名人有哪些,历史上姓徐的名人有哪些,翟,徐,0.39223862
2002年11月召开的党的什么？,203年11月召开的党的什么？,2002年,203年,1.0
欧阳震华的电视剧,欧阳娜娜的电视剧,欧阳震华,欧阳娜娜,-0.00582764
长春岭到松原客车时刻表,长山到松原客车时刻表,长春岭,长山,0.04530601
新加坡到泰国多少公里,香港到泰国多少公里,新加坡,香港,0.685861
四川有什么派,安徽有什么派,四川,安徽,0.51674306
男主姓唐女主姓温的小说,男主姓周女主姓温的小说,唐女主,周女主,1.0
河北工程大学名人,河北工业大学名人,河北工程大学,河北工业大学,0.028172886
nba门票哪里买,cba门票哪里买,nba,cba,0.6196901
湘是什么地方,湘湖是什么地方,湘,湘湖,0.27711064
海淀公园可以搭帐篷吗,星海公园可以搭帐篷吗,海淀公园,星海公园,0.71021163
北京林业大学研究生分数线,北京化工大学研究生分数线,北京林业大学,北京化工大学,0.6692945
当下如何才能遇到自己喜欢的人,未来如何才能遇到自己喜欢的人,当下,未来,0.34245083
赣州到揭阳的火车时刻表,南昌到揭阳的火车时刻表,赣州,南昌,0.6584624
华中西湖在哪,江南西湖在哪,华中,江南,0.37437895
上海理工大学就业怎么样,成都理工大学就业怎么样,上海理工大学,成都理工大学,0.61728466
沈阳至海拉尔,沈阳至广州,海拉尔,广州,0.34066823
天津至深圳多少公里,福州至深圳多少公里,天津,福州,0.47431472
全国有多少姓曹的,全国有多少姓胡的,曹,胡,0.3452232
无锡到周庄多少公里,无锡机场到周庄多少公里,无锡,无锡机场,-0.017936219
宁国到巢湖的火车时刻表,上海到巢湖的火车时刻表,宁国,上海,0.27638823
血小板增多症,血小板赠多症,血小板增多症,血小板赠多症,1.0
张雨涵的英语怎么写,张韶涵的英语怎么写,张雨涵,张韶涵,0.0948311
河南卫视新台标,陕西卫视新台标,河南卫视,陕西卫视,1.0
安徽500强企业名单,山西500强企业名单,安徽,山西,0.57228357
南京五塘新村房价,南京南京房价,五塘新村,南京,0.022114575
83年猪2020年运程,83年猪2021年运程,2020年,2021年,1.0
贵阳到广州的高铁票,天津到广州的高铁票,贵阳,天津,0.41494083
广州哪些公园好玩,洛阳哪些公园好玩,广州,洛阳,0.37967086
广州属于那里,西安属于那里,广州,西安,0.5353148
1970年农历9月27是什么星座,1970年农历五月27是什么星座,9月27,五月27,1.0
红烧肉菜谱,蛋卷菜谱,红烧肉,蛋卷,0.65854466
乌鲁木齐到哈尔滨机票多少钱,拉萨到哈尔滨机票多少钱,乌鲁木齐,拉萨,0.5508315
浙江和重庆距离多远,浙江和江西距离多远,重庆,江西,0.39728737
朱德是那里人,朱徳是那里人,朱德,朱徳,0.022301206
南昌信访局地址,石家庄信访局地址,南昌信访局,石家庄信访局,1.0
北京舞蹈学院要多少分才能考上,北京服装学院要多少分才能考上,北京舞蹈学院,北京服装学院,0.6473483
三亚有水果批发市场吗,齐齐哈尔有水果批发市场吗,三亚,齐齐哈尔,0.3137308
中国农业银行忘记卡号怎么办,农业银行忘记卡号怎么办,中国农业银行,农业银行,0.7107195
枣庄服装厂哪里多,中国服装厂哪里多,枣庄服装厂,中国服装厂,1.0
丽江离重庆有多远,丽江离南宁有多远,重庆,南宁,0.49294925
3月是什么节气,三月是什么节气,3月,三月,-0.041847292
昆明的电影院,长沙的电影院,昆明,长沙,0.4515315
心脏早搏如何治疗,心脏早博如何治疗,心脏早搏,心脏早博,1.0
1986年属虎和什么属相最配,87年属虎和什么属相最配,1986年,87年,1.0
南京到福建,南京到天津,福建,天津,0.432249
农行不良率,建行不良率,农行,建行,0.66430837
徐州离义乌有多少公里,徐州离深圳有多少公里,义乌,深圳,0.39964095
林俊杰专辑为啥小十四,冉俊杰专辑为啥小十四,林俊杰,冉俊杰,0.11300114
12月9日是什么星座,2月9日是什么星座,12月9日,2月9日,1.0
1995年农历六月初四是什么星座？,1995年农历五月初四是什么星座？,农历六月初四是什么星座,农历五月初四是什么星座,1.0
昆明理工大学非全日制研究生怎么上课,武汉理工大学非全日制研究生怎么上课,昆明理工大学,武汉理工大学,0.67684686
中国民生银行资产总额,中国人民银行资产总额,中国民生银行,中国人民银行,0.55198944
泗洪到蚌埠多少公里,泗洪县到蚌埠多少公里,泗洪,泗洪县,0.6424057
济阳有啥好玩的景点,日本有啥好玩的景点,济阳,日本,0.06693751
2020年过年是几月几日,2021年过年是几月几日,2020年,2021年,1.0
宿迁到北京有多少公里,宿迁到昆明有多少公里,北京,昆明,0.47584003
锡山区属于什么街道,宝山区属于什么街道,锡山区,宝山区,0.6023729
去珠海坐什么车方便,去重庆坐什么车方便,珠海,重庆,0.35571852
现在广州可以回安徽吗,现在广州可以回河南吗,安徽,河南,0.5888322
一美元等于多少欧元,三万日元等于多少人民币,欧元,人民币,0.6441387
小度小度今天天气怎么样,小度小度小度小度今天天气怎么样,小度小度,小度小度小度小度,1.0
西安职工医保报销比例,天津职工医保报销比例,西安,天津,0.50678104
南方医院怎么样,济南医院怎么样,南方医院,济南医院,0.058966972
出生于南京的名人,出生于济南的名人,南京,济南,0.5613268
3月1是什么星座,3月6是什么星座,3月1,3月6,1.0
天水师范学院录取分数线2018,通化师范学院录取分数线2018,天水师范学院,通化师范学院,1.0
英国的国宝动物是什么,加拿大的国宝动物是什么,英国,加拿大,0.68535894
铜陵市有哪些镇,乐陵市有哪些镇,铜陵市,乐陵市,0.54645616
东北师范大学综合排名,西北师范大学综合排名,东北师范大学,西北师范大学,0.6966403
衡水到湖北襄阳多少公里,安徽到湖北襄阳多少公里,衡水,安徽,0.2950498
1987年婚配什么生肖,1988年婚配什么生肖,1987年,1988年,1.0
糖尿病人能吃南瓜吗,糖尿病人能吃黄南瓜吗,南瓜,黄南瓜,-0.03712181
香港哪些地区,中国哪些地区,香港,中国,0.4250304
赤峰2030年规划,广州2030年规划,赤峰,广州,0.30945402
1974年正月二十六是几月几号,1974年腊月二十六是几月几号,正月,腊月,0.6617779
川菜怎么做,鱼香肉丝怎么做,川菜,鱼香肉丝,0.59753877
福州市经济适用房申请条件,温州市经济适用房申请条件,福州市,温州市,0.58801246
北京语言大学排行,北京交通大学排行,北京语言大学,北京交通大学,0.6766763
浙江的专科大学,内蒙古的专科大学,浙江,内蒙古,0.42366853
贵州2019中考录取分数线,青海2019中考录取分数线,贵州,青海,0.54570556
北京城市学院大专分数线,北京服装学院大专分数线,北京城市学院,北京服装学院,0.77751285
兰州的面积,长沙的面积,兰州,长沙,0.38391024
长沙到运城多少公里,福州到运城多少公里,长沙,福州,0.46591017
7月30日是什么星座,七月一日是什么星座,7月30日,七月一日,1.0
山东省艺术文化课分数线,甘肃省艺术文化课分数线,山东省,甘肃省,0.54376864
河南管辖城市,陕西管辖城市,河南,陕西,0.65962094
香港大学读研一年费用,香港城市大学读研一年费用,香港大学,香港城市大学,0.68337464
湖南大学大概什么时候开学,河南大学大概什么时候开学,湖南大学,河南大学,0.5965529
海南第一大城市,吉林第一大城市,海南,吉林,0.3977722
广东 电价,海南 电价,广东,海南,0.6069046
外阴白斑萎缩怎么治,外阴白斑怎么治,外阴白斑萎缩,外阴白斑,1.0
胶州一中录取分数线2019,郴州一中录取分数线2019,胶州一中,郴州一中,1.0
河北跨市需要隔离吗,安徽跨市需要隔离吗,河北,安徽,0.544361
昆明比较好的高中有哪些,长沙比较好的高中有哪些,昆明,长沙,0.4515315
郑州轻工业学院好不好,郑州轻工业大学好不好,郑州轻工业学院,郑州轻工业大学,0.03756211
天津哪个医院看哮喘好,西安哪个医院看哮喘好,天津,西安,0.50678104
北京最好的皮肤科医院,重庆最好的皮肤科医院,北京,重庆,0.47868326
成都至广州的火车,成都至福州的火车,广州,福州,0.5978892
嵩山北路属于哪个区,太行北路属于哪个区,嵩山北路,太行北路,1.0
苏州城市面积多少平方公里,香港城市面积多少平方公里,苏州,香港,0.27427462
长沙卖书的地方在哪里,昆明卖书的地方在哪里,长沙,昆明,0.4515315
安徽特产茶叶,湖南特产茶叶,安徽,湖南,0.55059975
齐齐哈尔房价走势,宜都房价走势,齐齐哈尔,宜都,0.21191089
西安交大联系电话,重庆交通大学联系电话,西安交大,重庆交通大学,0.024121376
刘德华父亲是谁,霍德华父亲是谁,刘德华,霍德华,0.06164057
南通著名企业家,武汉著名企业家,南通,武汉,0.40188128
陕西新能源项目,海南新能源项目,陕西,海南,0.3797359
亚太财险客服电话多少,亚太财产保险客服电话多少,亚太财险,亚太财产保险,1.0
李敏镐头发是什么颜色？,房敏镐头发是什么颜色？,李敏镐,房敏镐,1.0
临汾到河南安阳多少公里,山东到河南安阳多少公里,临汾,山东,0.3869159
阴历4月14是什么日子,阴历4月13是什么日子,4月14,4月13,1.0
1986年阳历11月26日是什么星座?,1986年阳历1月26日是什么星座?,11月26日,1月26日,1.0
浙江卫视台长是谁,浙江电视台台长是谁,浙江卫视,浙江电视台,0.026234454
武警工程大学2018年录取分数线,武警工程大学2019年录取分数线,2018年,2019年,1.0
左眄怎么读,左辅怎么读,左眄,左辅,-0.0040326086
超甜英语怎么说,超完美英语怎么说,超甜英语,超完美英语,1.0
西华大学多少人,南华大学多少人,西华大学,南华大学,0.5736033
宁晋有啥好玩的地方,澳门有啥好玩的地方,宁晋,澳门,0.10264753
2019肇庆中学中考录取分数线,2019春晖中学中考录取分数线,2019肇庆中学,2019春晖中学,1.0
中梁镇属于哪个区,中国属于哪个区,中梁镇,中国,0.006559303
意大利丙级联赛排名,中国丙级联赛排名,意大利,中国,0.34818554
郑州到卫辉大巴,郑州到重庆大巴,卫辉,重庆,0.28519097
2018年的贺岁电影有哪些,2019年的贺岁电影有哪些,2018年,2019年,1.0
南京到青岛机票多少钱一张,杭州到青岛机票多少钱一张,南京,杭州,0.65717953
郑州哪家白癜风医院信誉好,福州哪家白癜风医院信誉好,郑州,福州,0.44664824
凌晨2:00有什么花开,凌晨2点有什么花开,2:00,2点,1.0
吕叔潜是谁,吕是谁,吕叔潜,吕,-0.046617627
杭州今天有地震吗,苏州今天有地震吗,杭州,苏州,0.67312616
吴亦凡在EXO的地位,吴亦凡在exo的地位,EXO,exo,0.03965604
南理工分数线,太原理工分数线,南理工,太原理工,0.05556414
农历7月17是什么星座,农历7月11是什么星座,7月17,7月11,1.0
西藏有没有大学,河北有没有大学,西藏,河北,0.3232619
辽宁回上海要隔离14天吗,河南回上海要隔离14天吗,辽宁,河南,0.5069045
西藏种地吗,台湾种地吗,西藏,台湾,0.4028763
盐城到滨州多少公里,丹阳到滨州多少公里,盐城,丹阳,0.40220535
东兴证券怎么充值,东莞证券怎么充值,东兴证券,东莞证券,1.0
潜江市是什么级别,三门峡市是什么级别,潜江市,三门峡市,0.53080803
贵阳八中在哪,郑州八中在哪,贵阳八中,郑州八中,1.0
武汉的简称是什么,南昌的简称是什么,武汉,南昌,0.59227014
欣妍的拼音怎么写,刘欣妍的拼音怎么写,欣妍,刘欣妍,1.0
内蒙古啥时候下雨,山西啥时候下雨,内蒙古,山西,0.5715548
密集恐惧症怎么治疗,密极恐惧症怎么治疗,密集恐惧症,密极恐惧症,1.0
西北政法大学是不是985,西南政法大学是不是985,西北政法大学,西南政法大学,0.70670545
华安保险公众号是多少,大地保险公众号是多少,华安保险公众号,大地保险公众号,1.0
怀孕能吃榛蘑吗,怀孕能吃胶玉蘑吗,榛蘑,胶玉蘑,-0.03333068
4月20日是什么星座,四月四日是什么星座,4月20日,四月四日,1.0
北京大学研究生复试比例,北京科技大学研究生复试比例,北京大学,北京科技大学,0.57007235
广州有哪些旅行社,南昌有哪些旅行社,广州,南昌,0.50698376
华罗庚是什么样的人？,华柯庚是什么样的人？,华罗庚,华柯庚,0.040841002
怀孕能吃南瓜吗,怀孕能吃牛肝菌吗,南瓜,牛肝菌,0.36377808
土豆丝怎么炒,蜂蜜柚子茶怎么做,土豆丝,蜂蜜柚子茶,-0.00011594544
美沙舒是什么药物,美沙是什么药物,美沙舒,美沙,1.0
oppo是哪国的手机,华为是哪国的手机,oppo,华为,0.3205622
3月26日什么星座,三月六日什么星座,3月26日,三月六日,1.0
蛋白质2+是什么意思,蛋白质1+是什么意思,蛋白质2+,蛋白质1+,1.0
温岭市属于那个省,温哥华属于那个省,温岭市,温哥华,0.18419029
哈尔滨师范大学排名全国第几,哈佛大学排名全国第几,哈尔滨师范大学,哈佛大学,0.4194582
苏丹的人种,叙利亚的人种,苏丹,叙利亚,0.6341871
西安到莱西,西安到成都,莱西,成都,0.099266514
威尔士总部电话,中国总部电话,威尔士,中国,0.19018541
急性椎间盘突出怎么治疗,椎间盘突出怎么治疗,急性椎间盘,椎间盘,-0.055826575
江西省2019年艺术录取分数线,江西省2020年艺术录取分数线,2019年,2020年,1.0
宝鸡到兰州有多少公里,宝鸡到杭州有多少公里,兰州,杭州,0.44357944
花都最好的口腔医院,上海最好的口腔医院,花都,上海,0.21756624
窦娥是怎么死的,刘娥是怎么死的,窦娥,刘娥,0.37598383
重庆至浙江有多少公里,重庆至武汉有多少公里,浙江,武汉,0.34483218
网易和腾讯哪个市值高,百度和腾讯哪个市值高,网易,百度,0.5949177
明天天秤座运势,明天天蝎座运势,天秤座,天蝎座,0.8268891
吴江市属于哪个省份,江山市属于哪个省份,吴江市,江山市,0.5835972
描写金秋十月的诗句？,描写金秋九月的诗句？,十月,九月,0.8515602
张炎夏怎么了,张丽怎么了,张炎夏,张丽,-0.034210034
贵阳到锦屏多少公里,贵阳到锦屏县多少公里,锦屏,锦屏县,0.50239027
2018年好看的电影。,2019年好看的电影。,2018年,2019年,1.0
哈尔滨学院几本,哈尔滨林业大学几本,哈尔滨学院,哈尔滨林业大学,1.0
12月19是什么星座的,12月1是什么星座的,12月19,12月1,1.0
湖南帅哥多不多,湖北帅哥多不多,湖南,湖北,0.67319965
西安到韩城汽车,西安到广州汽车,韩城,广州,0.14424387
农发行待遇怎么样,中国农业银行待遇怎么样,农发行,中国农业银行,0.6914296
吃红提子有什么好处,吃青提子有什么好处,红提子,青提子,1.0
聊城到沈阳,聊城到成都,沈阳,成都,0.50356764
西北师大考研分数线,东北师范大学考研分数线,西北师大,东北师范大学,0.65716493
南昌批发雪糕的地方,许昌批发雪糕的地方,南昌,许昌,0.40712988
延吉到唐山多少公里,延吉到深圳多少公里,唐山,深圳,0.34376732
赤峰到银川火车,唐山到银川火车,赤峰,唐山,0.40071872
莱普油烟机怎么样,莱普吸油烟机怎么样,莱普油烟机,莱普吸油烟机,1.0
1942年生的人是什么生肖,1943年生的人是什么生肖,1942年,1943年,1.0
昆明当地最低工资标准,长春当地最低工资标准,昆明,长春,0.4079699
中国建设银行郴州网点,中国工商银行郴州网点,中国建设银行,中国工商银行,0.822597
上海外国语大学研究生初试分数线,西安外国语大学研究生初试分数线,上海外国语大学,西安外国语大学,0.7469972
苏州有地铁吗,苏州站有地铁吗,苏州,苏州站,0.38546124
南充到重庆,马鞍山到重庆,南充,马鞍山,0.3200521
潍坊至新乡火车时刻表,南昌至新乡火车时刻表,潍坊,南昌,0.42180145
台北在哪个省,重庆在哪个省,台北,重庆,0.3611963
如何用手机看湖南卫视直播,如何用手机看浙江卫视直播,湖南卫视,浙江卫视,0.043216538
盐城离无锡多远,盐城离青岛多远,无锡,青岛,0.42375574
云南师范大学是重点大学吗,湖南师范大学是重点大学吗,云南师范大学,湖南师范大学,0.63057125
王洋的丈夫是谁,龙洋的丈夫是谁,王洋,龙洋,0.19601169
津南区双港邮编,津南区双港镇邮编,双港,双港镇,0.6775481
北京大学录取分数线,北交大录取分数线,北京大学,北交大,0.4551102
镇海中学有多少学生,鄱阳中学有多少学生,镇海中学,鄱阳中学,1.0
江苏省二建缴费,江苏二建缴费,江苏省,江苏,0.71758956
八下英语六单元重点句子,八下英语一单元重点句子,八下英语六单元重点句子,八下英语一单元重点句子,1.0
11月22是什么星座的,十一月22是什么星座的,11月22,十一月22,1.0
湖南到衡阳多少公里,湖南到贵州多少公里,衡阳,贵州,0.4041947
天津在哪里?,南京在哪里?,天津,南京,0.5367533
石家庄到芜湖,长沙到芜湖,石家庄,长沙,0.3918293
德州电话区号,香港电话区号,德州,香港,0.24841696
北京联合大学2020研究生复试名单,北京建筑大学2020研究生复试名单,北京联合大学,北京建筑大学,0.05160765
北京到九台火车时刻表查询,北京到福州火车时刻表查询,九台,福州,0.27361304
3月20日是什么星座,3月9日是什么星座,3月20日,3月9日,1.0
如东到张家港,如东到张家口,张家港,张家口,0.35547885
洪家楼有什么好玩的,澳门有什么好玩的,洪家楼,澳门,0.2232378
盐城中考总分多少,合肥中考总分多少,盐城,合肥,0.46613413
太原距离徐州多少公里,太原距离济南多少公里,徐州,济南,0.5972319
日平均余额怎么算,日均余额怎么算,日平均余额,日均余额,1.0
夜间是指什么时间段,晚上是指什么时间段,夜间,晚上,0.6391053
富士康补办厂牌,深圳富士康补办厂牌,富士康,深圳富士康,0.042142563
甘肃省空置房物业费收取标准,河北省空置房物业费收取标准,甘肃省,河北省,0.577815
南京邮电大学在四川录取分数线,南京大学在四川录取分数线,南京邮电大学,南京大学,0.64520735
郑州至乌鲁木齐高铁时刻表,银川至乌鲁木齐高铁时刻表,郑州,银川,0.549342
东北的旅游景点有哪些,新加坡的旅游景点有哪些,东北,新加坡,0.15537149
iphone7双卡双待吗,iphonex双卡双待吗,iphone7,iphonex,1.0
潍坊到临朐物流,潍坊到成都物流,临朐,成都,0.23806475
李流芳是哪个朝代的,李是哪个朝代的,李流芳,李,-0.009854425
现在法国到中国机票多少钱,现在日本到中国机票多少钱,法国,日本,0.5135598
西宁哪里能治癫痫,银川哪里能治癫痫,西宁,银川,0.6294465
华为诺娃七的价格,华为诺娃六的价格,诺娃七,诺娃六,1.0
如何查看qq密码,如何查看qq邮箱密码,qq,qq邮箱,0.044774424
太谷离平遥古城有多远,太谷县离平遥古城有多远,太谷,太谷县,0.60946304
8月14日什么星座,七月十四什么星座,8月14日,七月十四,1.0
厦门旅游住哪里,西宁旅游住哪里,厦门,西宁,0.40528724
新冠病毒是什么,病毒是什么,新冠病毒,病毒,0.09285631
湖南城市学院是几本,湖南文理学院是几本,湖南城市学院,湖南文理学院,1.0
2020年西北工业大学研究生复试名单,2020年河南工业大学研究生复试名单,西北工业大学,河南工业大学,0.057244368
河南美食名字,四川美食名字,河南,四川,0.51187795
湖北有哪些古建筑,宁夏有哪些古建筑,湖北,宁夏,0.42543665
渭南事业编制工资,渭南市事业编制工资,渭南,渭南市,0.5705595
四川行政编码,江西行政编码,四川,江西,0.54122955
呼和浩特到长沙的飞机票,呼和浩特到重庆的飞机票,长沙,重庆,0.4618207
烟台是属于哪里,汉口是属于哪里,烟台,汉口,0.39555913
月经期间能吃莴苣吗,月经期间能吃莴苣叶吗,莴苣,莴苣叶,0.031997774
幽门螺旋杆菌高温能杀死吗,优门螺旋杆菌高温能杀死吗,幽门螺旋杆菌,优门螺旋杆菌,1.0
石家庄到吉林的飞机票多少钱,长沙到吉林的飞机票多少钱,石家庄,长沙,0.3918293
长春在哪里补办身份证,长春市在哪里补办身份证,长春,长春市,0.62467736
长春特色文化,长沙特色文化,长春,长沙,0.40587726
5月30日是什么星座,5月4日是什么星座,5月30日,5月4日,1.0
黄鲷鱼钓法,黄鲷鱼钓法视频,黄鲷鱼,黄鲷鱼钓法,1.0
乌鲁木齐pvc管生产厂家,长春pvc管生产厂家,乌鲁木齐,长春,0.39105174
孕妇可以喝蜂蜜柚子茶吗,孕妇可以喝蜂密柚子茶吗,蜂蜜柚子茶,蜂密柚子茶,1.0
涟源市属于哪个省哪个市,沽源县属于哪个省哪个市,涟源市,沽源县,0.65127724
通辽至北京航班,厦门至北京航班,通辽,厦门,0.4092586
首都经贸大学校长是谁,经贸大学校长是谁,首都经贸大学,经贸大学,0.76659113
仁川的英语,汶川的英语,仁川,汶川,0.24020055
莱玫眼膜怎么样,莱玫眼贴膜怎么样,莱玫眼膜,莱玫眼贴膜,1.0
黑龙江省长热线12345,江苏省长热线12345,黑龙江,江苏,0.41585216
大庆到绥化多少公里,大庆到深圳多少公里,绥化,深圳,0.24589656
长海医院体检套餐,东方医院体检套餐,长海医院,东方医院,0.69334996
oppo怎么打印,OPPO怎么打印,oppo,OPPO,0.6198677
南京林业大学开设专业,南京工业大学开设专业,南京林业大学,南京工业大学,0.6899666
南京玄武湖怎么样,南京银杏湖怎么样,玄武湖,银杏湖,0.07191761
中国明代名医,中国现代名医,明代,现代,0.28097475
吃石榴能减肥吗,吃豆腐能减肥吗,石榴,豆腐,0.3500179
考湖北美术学院要多少分,考广州美术学院要多少分,湖北美术学院,广州美术学院,0.76482236
巴东到广州,巴东到长沙,广州,长沙,0.5347093
小笼包怎么做,排骨怎么做好吃,小笼包,排骨,0.5417582
泰国是什么,巴基斯坦是什么,泰国,巴基斯坦,0.54455733
西安属于哪个省的,银川属于哪个省的,西安,银川,0.51534903
1972年农历8月18日什么星座,1972年农历三月八日什么星座,8月18日,三月八日,1.0
黑河到长春火车时刻表,天津到长春火车时刻表,黑河,天津,0.30847895
安徽理工大学多大,太原理工大学多大,安徽理工大学,太原理工大学,0.0501741
新乐市消费者投诉电话,泸州市消费者投诉电话,新乐市,泸州市,0.5094195
榆树市公积金电话,锡林浩特市公积金电话,榆树市,锡林浩特市,0.6235445
怀孕能吃冬菇吗,怀孕能吃花椰菜吗,冬菇,花椰菜,0.60471475
沧州到焦作的高铁时刻表,西安到焦作的高铁时刻表,沧州,西安,0.34938312
mee什么意思,mmee什么意思,mee,mmee,1.0
黄州到唐山火车票,黄州到厦门火车票,唐山,厦门,0.3655977
考湖北美术学院要多少分,考上海美术学院要多少分,湖北美术学院,上海美术学院,0.059093725
恩施到沈阳,上海到沈阳,恩施,上海,0.25417414
北京到辽源物流,北京到杭州物流,辽源,杭州,0.31944326
石家庄租房投诉电话,昆明租房投诉电话,石家庄,昆明,0.43568334
四川行政编码,云南行政编码,四川,云南,0.67304265
中山学校排名,中山医院排名,中山学校,中山医院,0.050343517
开封属于什么气候,德州属于什么气候,开封,德州,0.3693675
深圳到长春飞机票价格查询,深圳到银川飞机票价格查询,长春,银川,0.358079
中南民族大学缴费,云南民族大学缴费,中南民族大学,云南民族大学,0.09747507
渤海大学考研压分吗,海南大学考研压分吗,渤海大学,海南大学,0.060021915
怀孕能吃倭瓜吗,怀孕能吃露葵吗,倭瓜,露葵,0.39581966
"上海中学,复旦附中哪个好","上海中学,复旦哪个好",复旦附中,复旦,0.505239
东芝电视谁代工的,飞利浦电视谁代工的,东芝,飞利浦,0.52353364
15和95最大公因数,15和12最大公因数,95最大公因数,12最大公因数,1.0
宋慧敏是谁,李慧敏是谁,宋慧敏,李慧敏,1.0
昆明好的初中排名,呼和浩特好的初中排名,昆明,呼和浩特,0.42393872
内麦粒肿怎么引起的,内睑腺炎怎么引起的,内麦粒肿,内睑腺炎,1.0
玉溪有哪些大学,日本有哪些大学,玉溪,日本,0.09328609
星期一下雨吗,星期天下雨吗,星期一,星期天,0.6793415
工行预授信额度怎么查,工商银行预授信额度怎么查,工行,工商银行,0.62930137
杭州到天津多少公里,杭州到长沙多少公里,天津,长沙,0.38012704
流沙河的特点,中国的特点,流沙河,中国,0.13033043
华太吸油烟机怎么样,华太烟机怎么样,华太吸油烟机,华太烟机,1.0
陕西师范大学收费标准,辽宁师范大学收费标准,陕西师范大学,辽宁师范大学,0.6850069
