防灾科技学院在哪,河南科技学院在哪,防灾科技学院,河南科技学院,1.0
阳城县方言,中国方言,阳城县,中国,0.21033622
申通快递电话,无锡申通快递电话,申通,无锡申通快递,0.10012609
南昌市幼儿园收费标准,西昌市幼儿园收费标准,南昌市,西昌市,0.47909093
上海到德国飞机多少钱,上海到昆明飞机多少钱,德国,昆明,0.20216689
润州区有几个街道,甘州区有几个街道,润州区,甘州区,0.7433813
姓关的男明星,姓徐的男明星,关,徐,0.21481867
辽宁工业大学地址,淮北工业学校地址,辽宁工业大学,淮北工业学校,1.0
中国用英语怎么说,韩国用英语怎么说,中国,韩国,0.43105876
苏州在山东的哪个方向,苏州在江西的哪个方向,山东,江西,0.50710976
邯郸到瓦房店的火车票,邯郸到西安的火车票,瓦房店,西安,0.3656973
苇子坑邮编,内坑镇邮编,苇子坑,内坑镇,0.019695101
天猫精灵怎么语音控制,天猫精灵怎么语音,天猫精灵怎么语音控制,天猫精灵怎么语音,1.0
清河县到乌鲁木齐多少公里,西安到乌鲁木齐多少公里,清河县,西安,0.24445169
厦大教授名单,厦门大学教授名单,厦大,厦门大学,0.66757363
重庆现有人口多少人,重庆市现有人口多少人,重庆,重庆市,0.6397723
鸡西到大连的火车票,鸡西到天津的火车票,大连,天津,0.63644093
唐山到宁波飞机票多少钱,西安到宁波飞机票多少钱,唐山,西安,0.36184025
截止5月6日全国疫情情况,截止5月4日全国疫情情况,5月6日,5月4日,1.0
新兴县房价是多少,新昌县房价是多少,新兴县,新昌县,0.55653936
胆盐和胆汁酸,胆盐和胆汁酸盐,胆汁酸,胆汁酸盐,0.04411189
江苏省副主任医师考试时间,江苏副主任医师考试时间,江苏省,江苏,0.71758956
汕尾是属于潮汕吗,汕尾是属于潮汕地区吗,潮汕,潮汕地区,0.73312986
诸葛亮的儿子是谁,诸葛月的儿子是谁,诸葛亮,诸葛月,0.07635886
海南买车上牌新政策,海南省买车上牌新政策,海南,海南省,0.68230253
河南有影响力的媒体,湖南有影响力的媒体,河南,湖南,0.5099813
浏阳市人均可支配收入,宜昌市人均可支配收入,浏阳市,宜昌市,0.5281398
江西新农合咨询电话,广西新农合咨询电话,江西,广西,0.5668664
中国农业银行卡网上怎么激活,农业银行卡网上怎么激活,中国农业银行卡,农业银行卡,1.0
新干县有哪些乡镇,勐腊县有哪些乡镇,新干县,勐腊县,0.4906482
鲢鱼怎么做好吃,鲢鱼汤怎么做好吃,鲢鱼,鲢鱼汤,0.07413108
泽霈什么意思,泽翰什么意思,泽霈,泽翰,1.0
珠海唐家湾属于什么区,珠海唐家湾镇属于什么区,唐家湾,唐家湾镇,0.654271
河西学院占地面积多少亩,皖西学院占地面积多少亩,河西学院,皖西学院,0.02959806
1975年7月27日晚上11点多出生的人是什么命？,1976年7月27日晚上11点多出生的人是什么命？,1975年,1976年,1.0
南京航空航天大学就业方向,北京航空航天大学就业方向,南京航空航天大学,北京航空航天大学,0.7286789
乌鲁木齐pvc管生产厂家,南京pvc管生产厂家,乌鲁木齐,南京,0.4820054
兰州到南阳的火车,兰州到沈阳的火车,南阳,沈阳,0.33248058
清远旅游景点哪里好玩,清远市旅游景点哪里好玩,清远,清远市,0.4293079
临沧市有多少个乡镇,临沂市有多少个乡镇,临沧市,临沂市,0.44819552
万达集团总部电话号码,华为总部电话号码,万达集团,华为,0.31325534
爱的绝缘体是什么意思,爱的语言是什么意思,爱的绝缘体是什么意思,爱的语言是什么意思,1.0
航天员杨利伟是什么军衔,航天员杨伏伟是什么军衔,杨利伟,杨伏伟,0.073909
2019西北大学艺术录取分数线,2019西北政法大学艺术录取分数线,2019西北大学,2019西北政法大学,1.0
怀孕能吃腐竹吗,怀孕能吃鳊鱼吗,腐竹,鳊鱼,0.5128509
对中国现代教育的看法,对中国以往教育的看法,现代,以往,0.3407163
无限极总部在哪里,微软总部在哪里,无限极,微软,0.29637855
步步高的手机怎么样,华为的手机怎么样,步步高,华为,0.33347645
11月22是什么星座的,11月2是什么星座的,11月22,11月2,1.0
河南南阳小麦收割时间,河南省南阳小麦收割时间,河南,河南省,0.72307074
悉尼大学研究生开学时间,耶鲁大学研究生开学时间,悉尼大学,耶鲁大学,0.6251583
靳东演的电视剧,晓东演的电视剧,靳东,晓东,0.37646165
西溪海房价,海西路房价,西溪海,海西路,1.0
东晋到现在2018多少年,西汉到现在2018多少年,东晋,西汉,0.529809
r17pro支持5g吗,r17pro支持5g网络吗,5g,5g网络,1.0
碧桂园集团法人代表,碧桂园法人代表,碧桂园集团,碧桂园,0.73952156
打电话给老郭,打电话给郭,老郭,郭,0.27502367
1993年七月初八是什么命,1993年十月初八是什么命,七月初八,十月初八,1.0
中国农业银行咨询电话号码,中国人民银行咨询电话号码,中国农业银行,中国人民银行,0.58419144
遵化的房价是多少,西安的房价是多少,遵化,西安,0.29543
南京工业大学是名校吗,湖南工业大学是名校吗,南京工业大学,湖南工业大学,0.71152854
西南交大属于211还是985,西交大属于211还是985,西南交大,西交大,0.06855465
5和45最大公因数是多少,5和7最大公因数是多少,45最大公因数,7最大公因数,1.0
2000年农历2月24日是什么星座,2000年农历五月是什么星座,2月24日,五月,-0.015889864
免疫球蛋白多少钱一针,免疫求蛋白多少钱一针,免疫球蛋白,免疫求蛋白,0.08630114
开封到临汾火车时刻表查询,苏州到临汾火车时刻表查询,开封,苏州,0.4611955
2020华师大考研复试分数线,2020华东师范大学考研复试分数线,2020华师大,2020华东师范大学,1.0
江油市行政区划,延安市行政区划,江油市,延安市,0.5808848
通江到成都有多少公里,长沙到成都有多少公里,通江,长沙,0.2574811
覃的多音字,晏的多音字,覃,晏,0.27204278
吉水县属于哪个省哪个市,柞水县属于哪个省哪个市,吉水县,柞水县,0.6020746
战国时期的山西,战国时期的北京,山西,北京,0.42017746
1990年流行歌曲,1991年流行歌曲,1990年,1991年,1.0
兰州天气怎么样,柳州天气怎么样,兰州,柳州,0.47564015
西安到洋县多少公里,西安机场到洋县多少公里,西安,西安机场,0.36807743
删除十点半的闹钟,删除十点的闹钟,十点半,十点,0.00075045926
哈工大附中地址,哈师大附中地址,哈工大附中,哈师大附中,1.0
山西省考公告什么时候出,山西省省考公告什么时候出,山西省,山西省省,-0.017519213
南京现在天气怎么样,南京将来天气怎么样,现在,将来,0.44095436
南京理工大学什么时候复试,成都理工大学什么时候复试,南京理工大学,成都理工大学,0.6195616
hpv52阳性怎么治疗,hpv6阳性怎么治疗,hpv52,hpv6,1.0
天津体育学院教师待遇,武汉体育学院教师待遇,天津体育学院,武汉体育学院,0.8072733
南京的白酒,西安的白酒,南京,西安,0.550056
涟水高档小区有哪些,香港高档小区有哪些,涟水,香港,0.13099164
南昌去苏州,天津去苏州,南昌,天津,0.41647986
郑州至攀枝花火车时刻表,南京至攀枝花火车时刻表,郑州,南京,0.5071154
西安房屋交易政策,兰州房屋交易政策,西安,兰州,0.6150916
仙居县书记,凤翔县书记,仙居县,凤翔县,0.48061007
清远至广州距离,南京至广州距离,清远,南京,0.27350408
开封到临汾火车时刻表查询,郑州到临汾火车时刻表查询,开封,郑州,0.6363592
无锡打车到江阴多少钱,无锡打车到南通多少钱,江阴,南通,0.5613648
西安公积金贷款额度上限,西安市公积金贷款额度上限,西安,西安市,0.6519009
西安长安景点,西安长安区景点,长安,长安区,0.45494792
tfboy三个人的身高,tfboys三个人的身高,tfboy,tfboys,1.0
贵州女人怎么样?,广西女人怎么样?,贵州,广西,0.7030096
岩寺镇邮编,岩坦镇邮编,岩寺镇,岩坦镇,0.7943544
淮河有多长,沂河有多长,淮河,沂河,0.57923955
梧州学院王牌专业,贺州学院王牌专业,梧州学院,贺州学院,1.0
张卫健西游记一共多少集,钟卫健西游记一共多少集,张卫健,钟卫健,0.037833486
阿勒泰有什么特色美食,澳门有什么特色美食,阿勒泰,澳门,0.20099753
关机关机关机关机关机,小至关机,关机关机关机关机关机,小至关机,1.0
济南最宽的马路,郑州最宽的马路,济南,郑州,0.594944
枣庄到泰安高铁,哈尔滨到泰安高铁,枣庄,哈尔滨,0.35758594
张曼玉结过几次婚?,邓曼玉结过几次婚?,张曼玉,邓曼玉,-0.03464874
无锡高校有哪些,无锡市高校有哪些,无锡,无锡市,0.61511856
深圳怎么去澳门,深圳怎么去澳门机场,澳门,澳门机场,0.4904138
江苏在安徽的哪边,广东在安徽的哪边,江苏,广东,0.4945891
河北省中医院科室列表,河南省中医院科室列表,河北省中医院,河南省中医院,0.00016795103
盐城离镇江有多远,盐城离昆明有多远,镇江,昆明,0.3830685
哈尔滨西餐厅哪家好,哈尔滨癫痫哪家好,哈尔滨西餐厅,哈尔滨癫痫,1.0
内蒙古民族大学多少分,大连民族大学多少分,内蒙古民族大学,大连民族大学,1.0
5月29日是什么星座,5月4日是什么星座,5月29日,5月4日,1.0
甘肃省都包括哪些城市,黑龙江省都包括哪些城市,甘肃省,黑龙江省,0.5566766
渤海大学艺术类录取分数线,辽宁大学艺术类录取分数线,渤海大学,辽宁大学,0.039946485
平顶山学院有多少人,衡水学院有多少人,平顶山学院,衡水学院,1.0
太原理工大学最新全国排名,上海理工大学最新全国排名,太原理工大学,上海理工大学,0.06692703
2020年4月4号新闻内容,2020年四月六日新闻内容,4月4号,四月六日,1.0
江西吉安到南昌,江西吉安到杭州,南昌,杭州,0.5267346
西南交通大学研究生拟录取名单,西南石油大学研究生拟录取名单,西南交通大学,西南石油大学,0.036629282
沈阳到辽源高铁什么时候开通,沈阳到哈尔滨高铁什么时候开通,辽源,哈尔滨,0.5518593
怀孕能吃珍珠笋吗,怀孕能吃豆腐皮吗,珍珠笋,豆腐皮,-0.0070458706
台州到江苏,台州到浙江,江苏,浙江,0.6655316
工商银行是不是倒闭了,中国工商银行是不是倒闭了,工商银行,中国工商银行,0.7996922
哈尔滨工业大学税号,湖北工业大学税号,哈尔滨工业大学,湖北工业大学,0.60142994
天津市区属于哪个区,郑州市区属于哪个区,天津市区,郑州市区,1.0
同仁堂祛湿茶成分,北京同仁堂祛湿茶成分,同仁堂,北京同仁堂,-0.05357137
你的拥抱爱给谁给谁不用给我,我不要爱的拥抱,你的拥抱爱给谁给谁不用给我,我不要爱的拥抱,1.0
黑龙江十二年义务教育什么时候开始,辽宁十二年义务教育什么时候开始,黑龙江,辽宁,0.61363196
小说主角叶枫,小说主角林枫,叶枫,林枫,0.4342083
内蒙古师范大学2019年录取分数线,清华大学2019年录取分数线,内蒙古师范大学,清华大学,0.4804358
周伯通怎么死的,周敦颐怎么死的,周伯通,周敦颐,0.043826785
草莓月亮的寓意,草莓酱的寓意,草莓月亮,草莓酱,0.01341517
沈阳到东港多少公里,沈阳到厦门多少公里,东港,厦门,0.47431678
福建是亚热带吗,江苏是亚热带吗,福建,江苏,0.5023801
孔子老师是谁,木子老师是谁,孔子,木子,0.11037729
东北农业大学多少亩,山东农业大学多少亩,东北农业大学,山东农业大学,0.7201859
找梁静茹情歌的歌词。要完整版的。,找昌静茹情歌的歌词。要完整版的。,梁静茹,昌静茹,0.1043796
宋庆龄哪里人,宋美玲哪里人,宋庆龄,宋美玲,0.043170758
郑州黄金回收多少钱联络zhuocui66,重庆黄金回收多少钱联络zhuocui66,郑州,重庆,0.4815725
四平东到丹东动车时刻表,四平东到北京动车时刻表,丹东,北京,0.36837432
微信里的黑名单在哪,微信里面的黑名单在哪,里,里面,0.697933
西华师范大学属于哪个区,陕西师大属于哪个区,西华师范大学,陕西师大,1.0
黄土高原水土流失严重吗,云贵高原水土流失严重吗,黄土高原,云贵高原,0.5116979
印度名胜古迹有哪些,法国名胜古迹有哪些,印度,法国,0.5221069
郴州邮政电话号码,莆田邮政电话号码,郴州邮政,莆田邮政,1.0
安徽阜阳离哈尔滨有多远,安徽阜阳离深圳有多远,哈尔滨,深圳,0.43150857
重庆蔬菜价格,石家庄蔬菜价格,重庆,石家庄,0.39191484
安阳到兰考,安阳到厦门,兰考,厦门,0.17742242
邓丽君怎么死,邓九公怎么死,邓丽君,邓九公,0.18302773
哪些人不能去北京,哪些人不能去美国,北京,美国,0.30987975
山东高考体检费用,江苏高考体检费用,山东,江苏,0.59003085
蔡文涛是谁,陈文涛是谁,蔡文涛,陈文涛,0.0049946327
你已经死了用日文怎么说,你已经死了用日语怎么说,日文,日语,0.5967536
安徽理工大学多大,北京理工大学多大,安徽理工大学,北京理工大学,0.64213544
韩惠恩用韩文怎样读,韩游恩用韩文怎样读,韩惠恩,韩游恩,1.0
痛风可以吃红薯吗,痛风可以吃红薯粉吗,红薯,红薯粉,0.5649577
5月21日是什么星座,5月4日是什么星座,5月21日,5月4日,1.0
黄兴路房价,吴兴路房价,黄兴路,吴兴路,0.019601528
求李白《行路难》背景简介,求李密《行路难》背景简介,李白,李密,0.3719662
11月25是什么节日,五月25是什么节日,11月25,五月25,1.0
新疆的经度和纬度,澳门的经度和纬度,新疆,澳门,0.28468207
南宁市长热线电话?,成都市长热线电话?,南宁,成都,0.5061278
长沙去南京,洛阳去南京,长沙,洛阳,0.45322555
从哈尔滨到北京的机票,从哈尔滨到昆明的机票,北京,昆明,0.47584003
9月13日是什么星座,3月9日是什么星座,9月13日,3月9日,1.0
小米8手机换电池教程视频,小米5手机换电池教程视频,小米8,小米5,1.0
1996年6月6号是什么星座,97年6月6号是什么星座,1996年,97年,1.0
今年什么生意好做,未来什么生意好做,今年,未来,0.35303304
天津到白洋淀火车时刻表,天津到北京火车时刻表,白洋淀,北京,0.28564537
历史上姓周的名人,历史上姓倪的名人,周,倪,0.1959389
宜宾离绵阳有多远,宜宾离广州有多远,绵阳,广州,0.3643116
江西事业单位考几门,陕西事业单位考几门,江西,陕西,0.5069532
襄城县特产,虞城县特产,襄城县,虞城县,0.6758126
百得是什么品牌,Nike是什么品牌,百得,Nike,0.048347656
山东科技大学会计学怎么样,辽宁科技大学会计学怎么样,山东科技大学,辽宁科技大学,0.038938947
武汉比较有名的纹身店,北京比较有名的纹身店,武汉,北京,0.48840147
揭阳到无锡顺丰要多久,成都到无锡顺丰要多久,揭阳,成都,0.28563988
云南师范大学专升本录取分数线2019,河南师范大学专升本录取分数线2019,云南师范大学,河南师范大学,0.65048355
池州学院2019对口高考录取分数线,宿州学院2019对口高考录取分数线,池州学院,宿州学院,0.75454456
惠安有动车站吗,惠安县有动车站吗,惠安,惠安县,0.598982
孙悟空向谁借来定风丹,孙悟空向谁借定风丹,定风丹,风丹,0.047345977
坐月子能吃红薯吗,坐月子能吃红薯粉吗,红薯,红薯粉,0.5649577
焦作到日照多少公里,焦作到厦门多少公里,日照,厦门,0.29741466
西华师范大学属于哪个区,西北师范大学属于哪个区,西华师范大学,西北师范大学,0.021071503
浦发银行贷款要求,广发银行贷款要求,浦发银行,广发银行,0.7837818
三月23日是什么星座的,三月三23日是什么星座的,三月23日,三月三23日,1.0
无锡和哈尔滨哪个城市好,无锡和宁波哪个城市好,哈尔滨,宁波,0.4713472
扬州人口2020,中国人口2020,扬州,中国,0.22291848
3月5日是什么星座,3月9日是什么星座,3月5日,3月9日,1.0
昕旻怎么读,吴昕怎么读,昕旻,吴昕,0.026304735
7月7日是星期几,七月十三是星期几,7月7日,七月十三,1.0
华威大学和伯明翰大学哪个好,华威大学和爱丁堡大学哪个好,伯明翰大学,爱丁堡大学,0.7603428
梧州到田东动车时刻表,梧州到深圳动车时刻表,田东,深圳,0.38930434
swatch型号,iphonewatch型号,swatch,iphonewatch,0.035914417
6月9日是什么星座,3月9日是什么星座,6月9日,3月9日,1.0
王骞是哪里人,王小骞是哪里人,王骞,王小骞,1.0
杨凌到西安的火车时刻表,杨凌到天津的火车时刻表,西安,天津,0.50678104
印尼的钱叫什么,黎巴嫩的钱叫什么,印尼,黎巴嫩,0.5825527
东北师范大学综合排名,东北财经大学综合排名,东北师范大学,东北财经大学,0.58722275
兴义到株洲有多少公里,兴义到西安有多少公里,株洲,西安,0.3498853
怎样投诉工商银行,怎样投诉招商银行,工商银行,招商银行,0.70261556
11月27日是什么星座,1月27日是什么星座,11月27日,1月27日,1.0
昆明牙齿矫正医院排名,合肥牙齿矫正医院排名,昆明牙齿矫正医院,合肥牙齿矫正医院,1.0
开启双击亮屏,打开双击息屏,双击亮屏,双击息屏,1.0
华莱士怎么样,菲利华怎么样,华莱士,菲利华,-0.013997904
邢台是哪个省的,蚌埠是哪个省的,邢台,蚌埠,0.4205531
姓赖的取什么名字好听,姓唐的取什么名字好听,赖,唐,0.19530256
济南买猫去哪里买,福州买猫去哪里买,济南,福州,0.5079079
2020年湖南高考日期,2020年重庆高考日期,湖南,重庆,0.48353174
2019年广州暑假放假时间表,2020年广州暑假放假时间表,2019年,2020年,1.0
覃可以组什么词,仲可以组什么词,覃可以组什么词,仲可以组什么词,1.0
桑葚的功效,红薯的功效,桑葚,红薯,0.5374613
上海到拉萨火车软卧图片,成都到拉萨火车软卧图片,上海,成都,0.5381757
描写夏天的句子,描写秋天的句子,夏天,秋天,0.72536194
三亚学院占地面积,丽水学院占地面积,三亚学院,丽水学院,1.0
鄂尔多斯到扎兰屯多少公里,鄂尔多斯到福州多少公里,扎兰屯,福州,0.3412642
邢台新市长,呼和浩特新市长,邢台,呼和浩特,0.38211495
武汉中行营业网点,武汉中信银行营业网点,武汉中行,武汉中信银行,1.0
重庆下水管道堵了怎么疏通,郑州下水管道堵了怎么疏通,重庆,郑州,0.4815725
张嘉译的女儿叫什么,特朗普的女儿叫什么,张嘉译,特朗普,0.37370947
肝火旺怎么治,肝火望怎么治,肝火旺,肝火望,0.035893288
上海体育学院是几本,沈阳体育学院是几本,上海体育学院,沈阳体育学院,0.0071439943
4月26日是什么星座,四月六日是什么星座,4月26日,四月六日,1.0
opooa7x支持语音唤醒吗,oppoas支持语音唤醒吗,opooa7x,oppoas,1.0
2017年安徽省高考录取分数线,2017年辽宁省高考录取分数线,安徽省,辽宁省,0.51795363
怎么做糖醋排骨,怎么做红烧肉,糖醋排骨,红烧肉,0.76567423
福州到秦皇岛多少公里,广州到秦皇岛多少公里,福州,广州,0.5978892
1983年100美元等于多少人民币,1984年100美元等于多少人民币,1983年,1984年,1.0
周防雪子身高,周防身高,周防雪子,周防,0.0032713034
郑州到济南汽车时刻表,济南到济南汽车时刻表,郑州,济南,0.594944
许海峰获得我国第一枚金牌是哪个项目？,冷海峰获得我国第一枚金牌是哪个项目？,许海峰,冷海峰,0.010673551
周培公怎么死的,周公瑾怎么死的,周培公,周公瑾,0.50187397
杨宇轩名字怎么样,杨宇飞名字怎么样,杨宇轩,杨宇飞,1.0
1966年12月21日生阳历是什么星座,1967年12月21日生阳历是什么星座,1966年12月21日,1967年12月21日,1.0
今天建设银行上班吗,周末建设银行上班吗,今天,周末,0.26362175
深圳哪个区最繁华,潮州哪个区最繁华,深圳,潮州,0.35467598
红烧带鱼怎么做,酸辣粉怎么做,红烧带鱼,酸辣粉,0.7976221
缅甸沿海吗,葡萄牙沿海吗,缅甸,葡萄牙,0.4400166
运城到广西飞机票,运城到新疆飞机票,广西,新疆,0.48279178
2019年四川有多少高考生,2019年陕西有多少高考生,四川,陕西,0.61573106
赵本山有上春晚吗？,赵本桓有上春晚吗？,赵本山,赵本桓,-0.007619495
尤溪一中分数线2019,广饶一中分数线2019,尤溪一中,广饶一中,1.0
中国近代名将,中国现代名将,近代,现代,0.65023625
吉安到铜仁火车票,吉安到珠海火车票,铜仁,珠海,0.36860982
尤溪一中分数线2019,涉县一中分数线2019,尤溪一中,涉县一中,1.0
昆山离黑龙江多少公里,昆山离杭州多少公里,黑龙江,杭州,0.38930136
美国现在几点了,美国晚上几点了,现在,晚上,0.2982123
贾宝玉在红楼春趣的性格特点,宝玉在红楼春趣的性格特点,贾宝玉,宝玉,0.6763002
银川到绵阳多少公里,银川到天津多少公里,绵阳,天津,0.38702744
北京大学哪个街道,北京交通大学哪个街道,北京大学,北京交通大学,0.5855658
武汉住院报销比例,西安住院报销比例,武汉,西安,0.5737732
爱因斯坦发明了什么？,禹因斯坦发明了什么？,爱因斯坦,禹因斯坦,-0.04290124
5月2日艺人,5月4日艺人,5月2日,5月4日,1.0
江西到吉林快递多少钱,江西到云南快递多少钱,吉林,云南,0.48529348
广东省哪个市人最少,河南省哪个市人最少,广东省,河南省,0.5441235
山西有没有宜家家居,山西有没有宜家,宜家家居,宜家,-0.014116602
佛山到太原火车,温州到太原火车,佛山,温州,0.3134985
2019年河南高考多少人,2019年浙江高考多少人,河南,浙江,0.51620996
开封离郑州有多少公里,成都离郑州有多少公里,开封,成都,0.42734626
明尼苏达排名,明尼苏达大学排名,明尼苏达,明尼苏达大学,0.5016826
承德距离邯郸多少公里,西安距离邯郸多少公里,承德,西安,0.4021241
12月26日是什么星座,2月26日是什么星座,12月26日,2月26日,1.0
12月7日是什么星座,2月7日是什么星座,12月7日,2月7日,1.0
朱耷的字,朱棣的字,朱耷,朱棣,0.036122672
北方工业大学研究生报录比,北京化工大学研究生报录比,北方工业大学,北京化工大学,0.6998107
青海是哪个省的?,新疆是哪个省的?,青海,新疆,0.6514618
滨州市隔离政策,延安市隔离政策,滨州市,延安市,0.60316384
上海交大什么专业好,上海理工大学什么专业好,上海交大,上海理工大学,0.67173856
济宁市特产,中国特产,济宁市,中国,0.2581123
山西大学排名全国第几位,西北大学排名全国第几位,山西大学,西北大学,0.58689487
98年去年多大,98年明年多大,去年,明年,0.5527209
沧县中学电话,赣县中学电话,沧县中学,赣县中学,1.0
天秤座的运势,天蝎座的运势,天秤座,天蝎座,0.8268891
姓余的男歌手,姓范的男歌手,余,范,0.13983601
林志玲和言承旭为什么分手,林志玲和赏承旭为什么分手,言承旭,赏承旭,0.08344739
3月23日是什么星座,3月9日是什么星座,3月23日,3月9日,1.0
南宁到贵阳的动车时刻表,南宁到西安的动车时刻表,贵阳,西安,0.46747762
香港城市大学什么时候开学,香港大学什么时候开学,香港城市大学,香港大学,0.68337464
沂水靠谱的装修公司,吴江靠谱的装修公司,沂水,吴江,0.38357788
关于王熙凤的诗词,关于王熙爱的诗词,王熙凤,王熙爱,0.018138865
湖北电视台帮忙热线,石家庄电视台帮忙热线,湖北电视台,石家庄电视台,0.7784442
2019江西科技师范大学专升本拟录取名单,2017江西科技师范大学专升本拟录取名单,2019江西科技师范大学,2017江西科技师范大学,1.0
四川音乐学院英文,武汉音乐学院英文,四川音乐学院,武汉音乐学院,0.7406426
今天会下雪吗,明儿会下雪吗,今天,明儿,0.36931303
大英县到成都,香港到成都,大英县,香港,0.17597578
十一月七号是星期几,十一月十七号是星期几,十一月七号,十一月十七号,1.0
安徽理工大学多大,南京理工大学多大,安徽理工大学,南京理工大学,0.72079325
邬思道为什么要那么多钱,邬先生为什么要那么多钱,邬思道,邬先生,0.7593953
现在疫情能去天津吗,现在疫情能去昆明吗,天津,昆明,0.41717649
牟定一中校长,固原一中校长,牟定一中,固原一中,1.0
赤峰到苏州市飞机票,赤峰到长沙飞机票,苏州市,长沙,0.32748523
达州到广州途径哪些站,达州到南京途径哪些站,广州,南京,0.5514874
太湖在哪个省,太湖湾在哪个省,太湖,太湖湾,-0.008332043
2019年都有什么电视剧,2020年都有什么电视剧,2019年,2020年,1.0
成都到海口机票,成都到武汉机票,海口,武汉,0.37213725
无锡到盘锦多少公里,无锡到福州多少公里,盘锦,福州,0.3339014
3月12日油价,3月9日油价,3月12日,3月9日,1.0
姓麦的男孩名字大全,姓李的男孩名字大全,麦,李,0.23958102
北京理工大学的邮编,武汉理工大学的邮编,北京理工大学,武汉理工大学,0.67392385
南昌融创乐园营业时间,哈尔滨融创乐园营业时间,南昌融创乐园,哈尔滨融创乐园,1.0
张晨这个名字怎么样,叶晨这个名字怎么样,张晨,叶晨,0.69857687
华南属于什么地方,华东属于什么地方,华南,华东,0.66738707
