2012年成人高考时间,2013年成人高考时间,2012年,2013年,1.0
平顶山到正阳,平顶山到深圳,正阳,深圳,0.093146846
湖南郴州职校有哪些,湖南郴州技工学校有哪些,湖南郴州职校,湖南郴州技工学校,1.0
中国工商银行身份证过期了怎么办,中国农业银行身份证过期了怎么办,中国工商银行,中国农业银行,0.7811102
大连大学计算机专业分数线,大连民族大学计算机专业分数线,大连大学,大连民族大学,0.008437061
江苏占地面积是多少平方千米,澳门占地面积是多少平方千米,江苏,澳门,0.24373454
西华师范大学属于哪个区,华师大属于哪个区,西华师范大学,华师大,0.031868163
华中科技大学2019在浙录取分数线,华中科技大学2019在浙江录取分数线,浙,浙江,0.56235284
南理工分数线,南昌理工分数线,南理工,南昌理工,0.05556414
北京协和医院急救电话,武汉协和医院急救电话,北京协和医院,武汉协和医院,0.7042327
江苏是哪个地区,青海是哪个地区,江苏,青海,0.39147255
1982年1月12日属什么生肖,1983年1月12日属什么生肖,1982年1月12日,1983年1月12日,1.0
邵阳到佛山,重庆到佛山,邵阳,重庆,0.3820581
通辽到张家界的飞机票,通辽到天津的飞机票,张家界,天津,0.20021237
慢性荨麻疹吃什么好,慢性寻麻疹吃什么好,慢性荨麻疹,慢性寻麻疹,1.0
陕西区域代码,辽宁区域代码,陕西,辽宁,0.49524203
湛江有什么好玩的,湛江市有什么好玩的,湛江,湛江市,0.64918524
小米八换个内屏要多少钱,小米8换个内屏要多少钱,小米八,小米8,1.0
1982年农历4月4日是什么星座,1982年农历五月是什么星座,4月4日,五月,-0.015889864
张含韵是哪年出生的,张韶涵是哪年出生的,张含韵,张韶涵,0.6054532
湖北省可以进出吗,湖北可以进出吗,湖北省,湖北,0.7158592
四川选调生政策,广东选调生政策,四川,广东,0.51932144
双色球5月5开奖结果,双色球6月6开奖结果,5月5,6月6,1.0
平湖到南通多少公里,平湖到南昌多少公里,南通,南昌,0.35370287
8月4日农历是多少,四月四日农历是多少,8月4日,四月四日,1.0
凌凌的含义,凌的含义,凌凌,凌,0.2671278
北京市的总人口,哈尔滨市的总人口,北京市,哈尔滨市,0.56460464
吉林最低工资标准,吉林市最低工资标准,吉林,吉林市,0.60822845
石家庄经济学院录取分数线,山东经济学院录取分数线,石家庄经济学院,山东经济学院,0.05500044
1月28日是什么星座,8月1日是什么星座,1月28日,8月1日,1.0
林本川是谁,林四娘是谁,林本川,林四娘,0.04840387
科大分数线,中国科大分数线,科大,中国科大,0.54755104
西南交通大学2020研究生分数线,西安交大2020研究生分数线,西南交通大学,西安交大,0.59941167
四川师范大学校训,辽宁师范大学校训,四川师范大学,辽宁师范大学,0.66343755
上海动物园游玩多长时间,成都动物园游玩多长时间,上海动物园,成都动物园,0.10342907
宙的拼音怎么拼写,玥的拼音怎么拼写,宙,玥,0.19917373
常州人好吗,漳州人好吗,常州,漳州,0.38277003
3月1是什么星座,3月31是什么星座,3月1,3月31,1.0
武汉都有哪些高校,石家庄都有哪些高校,武汉,石家庄,0.46256757
邵阳到广西,邵阳到长沙,广西,长沙,0.39612916
王健林哪里人,王福林哪里人,王健林,王福林,0.6352323
郑州到济南飞机,郑州到东京飞机,济南,东京,0.2852669
虎林到鸡西火车时刻表,虎林到鸡西市火车时刻表,鸡西,鸡西市,0.6587253
北京中医药大学学号,北京农业大学学号,北京中医药大学,北京农业大学,0.51783544
描写灵谷寺的古诗词,描写中国的古诗词,灵谷寺,中国,0.15417682
重庆是中国第一大城市吗,北京是中国第一大城市吗,重庆,北京,0.47868326
去年西安交大录取分数线,去年西交大录取分数线,西安交大,西交大,0.024121376
珠海到坦洲的大巴,珠海到深圳的大巴,坦洲,深圳,0.43414754
宜昌建行营业时间,宜昌建设银行营业时间,宜昌建行,宜昌建设银行,1.0
1990年一角的硬币值多少钱,89年一角的硬币值多少钱,1990年,89年,1.0
重庆医科大学复试线2020,南方医科大学复试线2020,重庆医科大学,南方医科大学,0.715156
上海到桐城物流专线,上海到广东物流专线,桐城,广东,0.22843754
林正英的电影,汪正英的电影,林正英,汪正英,0.022450304
演员郭新馨,演员馨,郭新馨,馨,-0.016281025
曼城和曼联谁厉害,皇马和曼联谁厉害,曼城,皇马,0.62253
遵义职高有哪些专业,衡阳职高有哪些专业,遵义,衡阳,0.46617714
国信证券是国企吗,中信证券是国企吗,国信证券,中信证券,0.8331877
陕西师范大学收费标准,湖南师范大学收费标准,陕西师范大学,湖南师范大学,0.6083877
北京大学2020考研分数线,北京农业大学2020考研分数线,北京大学,北京农业大学,0.5588046
北京交通大学国内排名,北京大学国内排名,北京交通大学,北京大学,0.5855658
北齐在哪里,冀北在哪里,北齐,冀北,0.2528161
芬兰有红灯区吗,塞尔维亚有红灯区吗,芬兰,塞尔维亚,0.5626261
山东选调生待遇,四川选调生待遇,山东,四川,0.47491488
河南工业大学的分数线是多少,河南大学的分数线是多少,河南工业大学,河南大学,0.066956356
4/7÷2等于几分之几,6/7÷2等于几分之几,4/7÷2等于几分之几,6/7÷2等于几分之几,1.0
太平盛世是什么意思,太平盛世的意思是什么,太平盛世是什么意思,太平盛世的意思是什么,1.0
上海飞韩国机票价格,上海飞台湾机票价格,韩国,台湾,0.46442026
中国美术馆门票多少钱,深圳美术馆门票多少钱,中国美术馆,深圳美术馆,0.70871085
今天荆州有什么新闻,今天北京有什么新闻,荆州,北京,0.19507797
西安工程大学是本科吗,南京信息工程大学是本科吗,西安工程大学,南京信息工程大学,1.0
拨打小杨的电话,拨打杨杨的电话,小杨,杨杨,0.3658151
湘潭大学2012年分数线,清华大学2012年分数线,湘潭大学,清华大学,0.017848466
广德县景点,中国景点,广德县,中国,0.20840381
中通北京到沈阳,中通快递北京到沈阳,中通,中通快递,1.0
太平盛世的意思,太平盛世的意思是什么,太平盛世的意思,太平盛世的意思是什么,1.0
中信银行铜仁网点,中信银行广东网点,铜仁,广东,0.372354
tx是什么格式,pdfx是什么格式,tx,pdfx,0.011463603
5月14生日是什么星座,5月5生日是什么星座,5月14,5月5,1.0
萝卜樱怎么做好吃,萝卜婴怎么做好吃,萝卜樱,萝卜婴,1.0
湖北工业大学研究生读几年,湖南工业大学研究生读几年,湖北工业大学,湖南工业大学,0.70918554
苹果的说说,洛川苹果的说说,苹果,洛川苹果,-0.106493816
甲状腺癌能吃豆制品吗,甲壮腺癌能吃豆制品吗,甲状腺癌,甲壮腺癌,0.0013648706
菏泽农行周末营业网点,菏泽建行周末营业网点,菏泽农行,菏泽建行,1.0
华罗庚是什么样的人？,华车庚是什么样的人？,华罗庚,华车庚,0.040841002
对郭沫若的评价,对郭敬明的评价,郭沫若,郭敬明,0.2238579
济南有什么市花,广州有什么市花,济南,广州,0.5119548
河南有什么河,湖南有什么河,河南,湖南,0.5099813
广州到恩施,广州到北京,恩施,北京,0.19654451
枣庄到泰安高铁,枣庄到兰州高铁,泰安,兰州,0.3967032
二级建造师教材2012年与2013年一样吗,二级建造师教材2012年与2014年一样吗,2013年,2014年,1.0
葫芦岛是属于哪个省,湖北是属于哪个省,葫芦岛,湖北,0.25129798
怀孕能吃豆腐皮吗,怀孕能吃豇豆吗,豆腐皮,豇豆,0.59312564
重庆公交车道时间,南昌公交车道时间,重庆,南昌,0.43988407
南宁到祁阳火车时刻表,南宁到武汉火车时刻表,祁阳,武汉,0.32506254
河南的简称是什么,西藏的简称是什么,河南,西藏,0.29175824
云南师范大学研究生补助,华南师范大学研究生补助,云南师范大学,华南师范大学,0.65394944
oppo11怎么截屏,OPPO11怎么截屏,oppo11,OPPO11,1.0
内蒙古师范大学所有专业,青海师范大学所有专业,内蒙古师范大学,青海师范大学,0.7567375
南宁皮卡限行规定,洛阳皮卡限行规定,南宁,洛阳,0.4403835
镇江到苏州多少公里,镇江到重庆多少公里,苏州,重庆,0.42915437
成都近期篮球比赛,贵阳近期篮球比赛,成都,贵阳,0.61969733
北京甲状腺最好的医院,北京市甲状腺最好的医院,北京,北京市,0.6168396
顺丰快递从河南到天津要多久,顺丰快递从海南到天津要多久,河南,海南,0.3540809
辽宁师范大学历任校长,湖南师范大学历任校长,辽宁师范大学,湖南师范大学,0.61484355
今天西安下雪了吗,今天哈尔滨下雪了吗,西安,哈尔滨,0.49304342
南京在北京的什么方向,哈尔滨在北京的什么方向,南京,哈尔滨,0.4618976
三月八是什么日子,三月十四是什么日子,三月八,三月十四,1.0
农历六月十四是几月几日,农历六月三十是几月几日,六月十四,六月三十,1.0
广州中考录取规则,合肥中考录取规则,广州,合肥,0.4245919
港头镇属于哪个县,林头镇属于哪个县,港头镇,林头镇,0.73908
设置十一点的闹钟,设置十点的闹钟,十一点,十点,1.0
吴江区行政级别,呈贡区行政级别,吴江区,呈贡区,1.0
江苏二本院校有哪些学校,重庆二本院校有哪些学校,江苏,重庆,0.3842593
淄博和济南哪个城市好,长沙和济南哪个城市好,淄博,长沙,0.35072848
现在湖北人能去温州吗,现在湖北人能去广州吗,温州,广州,0.48284325
周口到台州高铁票,周口到上海高铁票,台州,上海,0.4340649
石家庄有啥山,太原有啥山,石家庄,太原,0.58394086
22周可以做四维彩超吗,21周可以做四维彩超吗,22周,21周,1.0
无线路由器忘记密码怎么办,无限路由器忘记密码怎么办,无线路由器,无限路由器,1.0
外地去石家庄要隔离吗,外地去哈尔滨要隔离吗,石家庄,哈尔滨,0.5403147
重庆到贵州的距离,成都到贵州的距离,重庆,成都,0.71144456
独龙江有什么鱼,黑龙江有什么鱼,独龙江,黑龙江,0.3017012
八月十三是什么星座？,八月十五是什么星座？,八月十三是什么星座,八月十五是什么星座,1.0
宜宾市内哪里好玩,乐清市内哪里好玩,宜宾市,乐清市,0.50784975
农历7月17是什么星座,农历7月14是什么星座,7月17,7月14,1.0
心脏病能吃洋参吗,心脏病能吃蜂蜜吗,洋参,蜂蜜,0.5324202
五月天和信乐团哪个乐队更有实力？,五月天和信练团哪个乐队更有实力？,五月天和信乐团,五月天和信练团,1.0
怀孕能吃玉米笋吗,怀孕能吃鸡油菌吗,玉米笋,鸡油菌,0.058169305
海南离武汉有多少公里,浙江离武汉有多少公里,海南,浙江,0.38203484
中央戏剧学院位于,中央美术学院位于,中央戏剧学院,中央美术学院,0.6095638
邹城到青州多少公里,南京到青州多少公里,邹城,南京,0.23848636
有谁知道朱开山是哪个地方的人？,有谁知道池开山是哪个地方的人？,朱开山,池开山,1.0
隆回一中中考录取分数线,怀柔一中中考录取分数线,隆回一中,怀柔一中,1.0
打电话给林欣,打电话给陈萌,林欣,陈萌,0.020442434
1994旧历10月初9是什么星座,1994旧历八月初9是什么星座,1994旧历10月初9是什么星座,1994旧历八月初9是什么星座,1.0
漯河职业技术学院怎么样,运城职业技术学院怎么样,漯河职业技术学院,运城职业技术学院,1.0
十一月八日是星期几,十一月十八日是星期几,十一月八日,十一月十八日,1.0
印度出生率死亡率,美国出生率死亡率,印度,美国,0.47983572
台州到江苏,台州到香港,江苏,香港,0.2618806
福建省地理知识,甘肃省地理知识,福建省,甘肃省,0.505925
江西卫校排名,江苏卫校排名,江西,江苏,0.49176502
丽水到青田高铁时刻表,上海到青田高铁时刻表,丽水,上海,0.38029808
洛阳到焦作多少公里,洛阳到哈尔滨多少公里,焦作,哈尔滨,0.38172525
刘禹锡被称为什么,杜甫被称为什么,刘禹锡,杜甫,0.58021617
温州消费券使用规则,成都消费券使用规则,温州,成都,0.39505035
台山地理位置,狼牙山地理位置,台山,狼牙山,0.3407232
七乐彩开奖结果,七星彩开奖结果,七乐彩,七星彩,1.0
肠梗阻怎么治疗,肠耿阻怎么治疗,肠梗阻,肠耿阻,0.1254753
云南属于南方还是北方,蒙古属于南方还是北方,云南,蒙古,0.34419125
傻逼的英语,傻逼英语,傻逼的英语,傻逼英语,1.0
林书豪国籍,富兰克林国籍,林书豪,富兰克林,0.026487362
盘锦到江苏多少公里,盘锦到郑州多少公里,江苏,郑州,0.35610515
石家庄到吉林物流专线,石家庄到山西物流专线,吉林,山西,0.4949289
2010年银行房贷利率,2011年银行房贷利率,2010年,2011年,1.0
哈尔滨开车到烟台费用,哈尔滨开车到天津费用,烟台,天津,0.58981264
湖南师范大学具体地址,海南师范大学具体地址,湖南师范大学,海南师范大学,0.67684656
古代谁画的竹子最好,近代谁画的竹子最好,古代,近代,0.54012775
广东属于四川吗,安徽属于四川吗,广东,安徽,0.47742763
胃溃疡什么症状,胃溃阳什么症状,胃溃疡,胃溃阳,0.036171712
成都有几个客运站,长春有几个客运站,成都,长春,0.45779127
2020年重庆选调生报名时间,2020年广东选调生报名时间,重庆,广东,0.3866931
上海卫视相亲节目,湖北卫视相亲节目,上海卫视,湖北卫视,1.0
义乌到高邮,义乌到四川,高邮,四川,0.2465312
1971年属什么生肖属相,1972属什么生肖属相,1971年,1972,0.03194352
凯迪拉克cts报价,凯迪拉克ct5报价,凯迪拉克cts报价,凯迪拉克ct5报价,1.0
汉堡包怎么做,草莓蛋糕怎么做,汉堡包,草莓蛋糕,0.023042612
2009年交的社保什么时候可以领,2010年交的社保什么时候可以领,2009年,2010年,1.0
中国银行理财产品,中信银行理财产品,中国银行,中信银行,0.60422635
防灾科技学院在哪,湖南科技学院在哪,防灾科技学院,湖南科技学院,1.0
天蝎座排名第几,白羊座排名第几,天蝎座,白羊座,0.7840128
河北2019二本投档线,湖北2019二本投档线,河北,湖北,0.52139103
香港大学博士含金量,香港科技大学博士含金量,香港大学,香港科技大学,0.7280964
赵本山前妻,赵本丰前妻,赵本山,赵本丰,-0.007619495
农历七月29是什么星座?,农历七月19是什么星座?,农历七月29是什么星座,农历七月19是什么星座,1.0
西安到长沙开车多久,深圳到长沙开车多久,西安,深圳,0.43545276
剑桥大学在哪里,英国剑桥大学在哪里,剑桥大学,英国剑桥大学,0.7412942
2019年中考录取分数线武汉,2019年中考录取分数线兰州,武汉,兰州,0.4878543
吕姓的女明星,陈姓的女明星,吕姓,陈姓,0.60286045
滨州到德州的火车时刻表,成都到德州的火车时刻表,滨州,成都,0.2667266
王羲之是哪个朝代的人,王之涣是哪个朝代的人,王羲之,王之涣,0.33345705
丹东市公务员好考吗,肇东市公务员好考吗,丹东市,肇东市,0.64378095
麻城到上海,麻城到新疆,上海,新疆,0.35444605
邢台到廊坊大城多少公里,沧州到廊坊大城多少公里,邢台,沧州,0.57501215
武汉大学繁体字怎么写,百度繁体字怎么写,武汉大学,百度,0.18061355
驰宏锌锗十大股东,百度十大股东,驰宏锌锗,百度,0.09319814
江苏省的二本大学排名,山东省的二本大学排名,江苏省,山东省,0.6380597
虹桥中学招生办电话,合川中学招生办电话,虹桥中学,合川中学,0.06177407
山鹰乐队的歌曲,老鹰乐队的歌曲,山鹰乐队,老鹰乐队,0.049645063
七月三十日出生的人,七月初七出生的人,七月三十日,七月初七,1.0
鸡西到呼和浩特,鸡西到西安,呼和浩特,西安,0.4367304
商丘师范学院院长级别,曲靖师范学院院长级别,商丘师范学院,曲靖师范学院,1.0
湖南专科学院排名2019,山东专科学院排名2019,湖南专科学院,山东专科学院,1.0
泉州师范学院是一本吗,齐鲁师范学院是一本吗,泉州师范学院,齐鲁师范学院,0.08487701
韵达是马云的吗,韵达快递是马云的吗,韵达,韵达快递,1.0
2020杭州小升初摇号结果,2020杭州市小升初摇号结果,杭州,杭州市,0.6461742
长安在哪里,中国在哪里,长安,中国,0.22863516
1992年阴历6月16日是什么星座,1992年阴历四月六日是什么星座,6月16日,四月六日,1.0
怀孕能吃刺猬菌吗,怀孕能吃西洋菜吗,刺猬菌,西洋菜,1.0
武汉的简称是什么,合肥的简称是什么,武汉,合肥,0.53395385
南昌防腐木厂家,石家庄防腐木厂家,南昌,石家庄,0.46216857
成都老年公交卡办理,郑州老年公交卡办理,成都老年公交卡,郑州老年公交卡,1.0
定一个三点五十的闹铃,定一个四点五十的闹铃,三点五十,四点五十,1.0
2013年lpr利率,2014年lpr利率,2013年,2014年,1.0
周口到贵阳的高铁,昆明到贵阳的高铁,周口,昆明,0.2470261
辽宁鞍山到吉林多少公里,辽宁鞍山到重庆多少公里,吉林,重庆,0.43699852
北京林业大学美术录取分数线,南京林业大学美术录取分数线,北京林业大学,南京林业大学,0.7342111
北京西站到顺义地铁,北京西站到顺义区地铁,顺义,顺义区,0.5692597
河南媒体求助电话,浙江媒体求助电话,河南,浙江,0.51620996
东南亚冬季风和夏季风成因,东亚冬季风和夏季风成因,东南亚,东亚,0.5847798
三点五乘以零点四,三点六乘以零点四,三点五,三点六,1.0
四川省交通事故十级伤残赔偿标准,河南省交通事故十级伤残赔偿标准,四川省,河南省,0.49019253
江门到虎门汽车时刻表,江门到重庆汽车时刻表,虎门,重庆,0.282187
唐山到平顶山多少公里,唐山到合肥多少公里,平顶山,合肥,0.33925164
奔驰gla值得买吗,奔驰glc值得买吗,奔驰gla,奔驰glc,1.0
2019年双色球44期开奖号码,2020年双色球44期开奖号码,2019年,2020年,1.0
开封到芜湖的火车票,开封到北京的火车票,芜湖,北京,0.3817371
海南岛到乌鲁木齐多少公里,黑龙江到乌鲁木齐多少公里,海南岛,黑龙江,0.38240352
北航研究生学制,北邮研究生学制,北航,北邮,0.58074915
FOOD是什么意思,With是什么意思,FOOD,With,0.01496538
重庆最新楼盘开盘,太原最新楼盘开盘,重庆,太原,0.37752238
滨州到商丘火车时刻表,滨州到哈尔滨火车时刻表,商丘,哈尔滨,0.34857926
吉林市到石家庄多少公里,吉林市到天津多少公里,石家庄,天津,0.5828164
刘德华最新电影,霍德华最新电影,刘德华,霍德华,0.06164057
云南有几个机场,宁夏有几个机场,云南,宁夏,0.53232384
西安到成都高铁票多钱,秦安到成都高铁票多钱,西安,秦安,0.33275926
十三香小龙虾怎么做,鸡蛋饼怎么做,十三香小龙虾,鸡蛋饼,1.0
武夷学院多少亩,九江学院多少亩,武夷学院,九江学院,1.0
柳州到兖州火车时刻表,商丘到兖州火车时刻表,柳州,商丘,0.38195857
15和95最大公因数,15和9最大公因数,95最大公因数,9最大公因数,1.0
贵州车牌号城市代号,内蒙古车牌号城市代号,贵州,内蒙古,0.4704199
戍去掉一点是什么字,戌去掉一点是什么字,戍,戌,0.5810762
仁化县属于哪个省,芦山县属于哪个省,仁化县,芦山县,0.5811906
张家港有名的律师事务所,三亚有名的律师事务所,张家港,三亚,0.37530527
8月6是什么星座,8月31是什么星座,8月6,8月31,1.0
孕4月不小心撞到肚子,孕四月不小心撞到肚子,4月,四月,-0.01716448
湖南教师资格证考试时间2020年,吉林教师资格证考试时间2020年,湖南,吉林,0.4769616
济宁到溧阳多少公里,济宁到哈尔滨多少公里,溧阳,哈尔滨,0.22366716
北方民族大学校歌,中国民航大学校歌,北方民族大学,中国民航大学,0.73003477
华峰氨纶股价,华峰集团股价,华峰氨纶,华峰集团,1.0
山东大学硕士毕业要求,山东理工大学硕士毕业要求,山东大学,山东理工大学,0.57552814
犹他大学排名,温州大学排名,犹他大学,温州大学,0.540163
山西师范大学是双一流吗,山西财经大学是双一流吗,山西师范大学,山西财经大学,0.05006281
泾县到重庆多少公里,北京到重庆多少公里,泾县,北京,0.18553403
丹丹叫什么,丹叫什么,丹丹,丹,0.20683552
爱你用英语怎么说,爱你的英语怎么说,爱你用英语,爱你的英语,1.0
内蒙古通辽的,内蒙古通辽市的,通辽,通辽市,0.61376446
2020年长沙市社会平均工资,2020年北京市社会平均工资,长沙市,北京市,0.47505563
苏州大学2019年河南录取分数线,贵州大学2019年河南录取分数线,苏州大学,贵州大学,0.5464204
黑龙江省内什么快递最快,贵州省内什么快递最快,黑龙江省内,贵州省内,1.0
杭州高铁站附近有什么好玩的地方,南宁高铁站附近有什么好玩的地方,杭州,南宁,0.48474708
陈宇航名字,王宇航名字,陈宇航,王宇航,1.0
肇庆市有哪些县,中国有哪些县,肇庆市,中国,0.25604782
河口县的邮政编码,湖口县的邮政编码,河口县,湖口县,0.5574002
芜湖城市户口可以迁回农村吗,绍兴城市户口可以迁回农村吗,芜湖,绍兴,0.46006835
成都到江苏车票多少钱,成都到广州车票多少钱,江苏,广州,0.35211864
莫拉怎么画,米拉怎么画,莫拉,米拉,0.35977197
山西中医学院录取分数线2019,山西中北大学录取分数线2019,山西中医学院,山西中北大学,1.0
西南财大好不好,西南民族大学好不好,西南财大,西南民族大学,0.017992932
山东有什么山,广东有什么山,山东,广东,0.51451844
石家庄生日布置,广州生日布置,石家庄,广州,0.4059917
小米9关于手机,小米8关于手机,小米9,小米8,1.0
集美有几所中学,集美区有几所中学,集美,集美区,0.49133313
揭阳市属于哪个省份,浏阳市属于哪个省份,揭阳市,浏阳市,0.5550947
叶剑英是谁啊,雍剑英是谁啊,叶剑英,雍剑英,0.08789656
哈工大有几个校区,中山大学有几个校区,哈工大,中山大学,0.48619032
海南特产水果,辽宁特产水果,海南,辽宁,0.37202436
三江学院是三本吗,嘉兴学院是三本吗,三江学院,嘉兴学院,1.0
河南省南阳市有几个县区,河南南阳市有几个县区,河南省南阳市,河南南阳市,1.0
山东理工大学是几本,华东理工大学是几本,山东理工大学,华东理工大学,0.5586671
丹阳到深圳火车时刻表,丹阳到郑州火车时刻表,深圳,郑州,0.4099611
西安的体检中心有哪些,石家庄的体检中心有哪些,西安,石家庄,0.4870405
1970年女明星,1971年女明星,1970年,1971年,1.0
安岳哪里有鸡,泰安哪里有鸡,安岳,泰安,0.32337502
中国建设银行怎么修改手机号码,中国银行怎么修改手机号码,中国建设银行,中国银行,0.69678235
上海的市花是什么,柳州的市花是什么,上海,柳州,0.3087854
1月26日是什么星座,七月一日是什么星座,1月26日,七月一日,1.0
吉林是在哪个省,西藏是在哪个省,吉林,西藏,0.39007068
宁波网站优化排名,杭州网站优化排名,宁波,杭州,0.69207054
成都市就业服务管理局电话,成都就业服务管理局电话,成都市就业服务管理局,成都就业服务管理局,1.0
夏津县是哪个市,滨海县是哪个市,夏津县,滨海县,0.6305123
王祖蓝的老婆是谁,谢娜的老公是谁,王祖蓝,谢娜,0.6763082
南京爱彼维修网点,成都爱彼维修网点,南京爱彼,成都爱彼,1.0
8月25日是什么星座,三月八日是什么星座,8月25日,三月八日,1.0
十月26是什么星座,十月初五是什么星座,十月26是什么星座,十月初五是什么星座,1.0
昌乐名胜古迹有哪些,日本名胜古迹有哪些,昌乐,日本,0.15775576
10月26号出生的明星,十月十四出生的明星,10月26号,十月十四,1.0
山西的简称是啥,新疆的简称是啥,山西,新疆,0.48376614
昆山到连云港汽车票,重庆到连云港汽车票,昆山,重庆,0.2368397
贵阳市车辆尾号限行,南昌市车辆尾号限行,贵阳市,南昌市,0.5770007
新华保险险种介绍,华安保险险种介绍,新华保险,华安保险,1.0
十二月二十是什么星座,十二月是什么星座,十二月二十,十二月,-0.081363454
京东北京到西安,京东北京到北京,西安,北京,0.54513466
陕西计算机二级报名费多少钱,陕西省计算机二级报名费多少钱,陕西,陕西省,0.6996518
怀孕能吃乌芋吗,怀孕能吃结球甘蓝吗,乌芋,结球甘蓝,0.03419662
饭后跑步好吗,饭前跑步好吗,饭后,饭前,0.7320647
工商银行可以报几个岗位,农业银行可以报几个岗位,工商银行,农业银行,0.73226756
楚雄到景谷,楚雄到北京,景谷,北京,0.19743952
3月15号是什么星座,3月9日是什么星座,3月15号,3月9日,1.0
罗密欧与茱莉叶钢琴曲教程,罗密欧与朱丽叶钢琴曲教程,罗密欧与茱莉叶钢琴曲教程,罗密欧与朱丽叶钢琴曲教程,1.0
南京有捷达4s店吗,天津有捷达4s店吗,南京,天津,0.5367533
陕西师范大学的校训是什么,四川师范大学的校训是什么,陕西师范大学,四川师范大学,0.6819784
奔驰cl350多少钱,奔驰ml350多少钱,奔驰cl350,奔驰ml350,1.0
